corporateID,corporateName,corporateKana,cityID,location,moddate
8000030260085,旧当尾村財産区,キュウトウノムラザイサンク,26214,京都府木津川市木津南垣外１１０－９,2018-04-04T15:00:00.000Z
1000020268038,加茂笠置組合,カモカサギクミアイ,26214,京都府木津川市木津南垣外１１０番地９,2018-04-04T15:00:00.000Z
8000020268411,相楽中部消防組合,ソウラクチュウブショウボウクミアイ,26214,京都府木津川市木津白口１０番地２,2018-04-04T15:00:00.000Z
4000020263036,大山崎町,オオヤマザキチヨウ,26303,京都府乙訓郡大山崎町字円明寺小字夏目３,2018-04-04T15:00:00.000Z
3000020268283,乙訓環境衛生組合,オトクニカンキョウエイセイクミアイ,26303,京都府乙訓郡大山崎町字下植野小字南牧方３２,2018-04-04T15:00:00.000Z
4000030260089,久御山町三郷山財産区,クミヤマチョウサンゴウヤマザイサンク,26322,京都府久世郡久御山町佐古梶石,2018-04-04T15:00:00.000Z
8000020263222,久御山町,クミヤマチヨウ,26322,京都府久世郡久御山町島田ミスノ３８番地,2018-04-04T15:00:00.000Z
1000020263435,井手町,イデチヨウ,26343,京都府綴喜郡井手町大字井手小字南玉水６７,2018-04-04T15:00:00.000Z
2000030260090,井手町多賀財産区,イデチョウタガザイサンク,26343,京都府綴喜郡井手町大字井手小字南玉水６７,2018-04-04T15:00:00.000Z
1000020263443,宇治田原町,ウジタワラチヨウ,26344,京都府綴喜郡宇治田原町大字荒木小字西出１０,2018-04-04T15:00:00.000Z
3000020263648,笠置町,カサギチヨウ,26364,京都府相楽郡笠置町大字笠置小字西通９０－１,2018-04-04T15:00:00.000Z
3000020263656,和束町,ワヅカチヨウ,26365,京都府相楽郡和束町大字釜塚小字生水１４－２,2018-04-04T15:00:00.000Z
7000020268593,相楽東部広域連合,ソウラクトウブコウイキレンゴウ,26365,京都府相楽郡和束町大字中小字平田２３－１,2018-04-04T15:00:00.000Z
1000030260091,和束町湯船財産区,ワツカチョウユブネザイサンク,26365,京都府相楽郡和束町大字湯船小字五ノ瀬２５０番地,2018-04-04T15:00:00.000Z
3000020263664,精華町,セイカチヨウ,26366,京都府相楽郡精華町大字南稲八妻小字北尻７０番地,2018-04-04T15:00:00.000Z
5000020268216,相楽郡西部塵埃処理組合,ソウラクグンセイブジンアイショリクミアイ,26366,京都府相楽郡精華町大字北稲八間小字打越８４,2018-04-04T15:00:00.000Z
3000020263672,南山城村,ミナミヤマシロムラ,26367,京都府相楽郡南山城村大字北大河原小字久保１４－１,2018-04-04T15:00:00.000Z
5000030260096,三ノ宮財産区,サンノミヤザイサンク,26407,京都府船井郡京丹波町蒲生八ツ谷６２番地６,2018-04-04T15:00:00.000Z
9000030260092,須知財産区,シュウチザイサンク,26407,京都府船井郡京丹波町蒲生八ツ谷６２番地６,2018-04-04T15:00:00.000Z
4000020264075,京丹波町,キヨウタンバチヨウ,26407,京都府船井郡京丹波町蒲生八ツ谷６２番地６,2018-04-04T15:00:00.000Z
6000030260095,梅田財産区,ウメダザイサンク,26407,京都府船井郡京丹波町蒲生八ツ谷６２番地６,2018-04-04T15:00:00.000Z
7000030260094,桧山財産区,ヒノキヤマザイサンク,26407,京都府船井郡京丹波町蒲生八ツ谷６２番地６,2018-04-04T15:00:00.000Z
8000030260093,高原財産区,タカハラザイサンク,26407,京都府船井郡京丹波町蒲生八ツ谷６２番地６,2018-04-04T15:00:00.000Z
4000030260097,質美財産区,シツミザイサンク,26407,京都府船井郡京丹波町蒲生八ツ谷６２番地６,2018-04-04T15:00:00.000Z
5000020264636,伊根町,イネチヨウ,26463,京都府与謝郡伊根町字日出６５１,2018-04-04T15:00:00.000Z
3000030260098,朝妻財産区,アサヅマザイサンク,26463,京都府与謝郡伊根町字日出６５１番地,2018-04-04T15:00:00.000Z
2000030260099,本庄財産区,ホンジョウザイサンク,26463,京都府与謝郡伊根町字日出６５１番地,2018-04-04T15:00:00.000Z
1000030260100,筒川財産区,ツツカワザイサンク,26463,京都府与謝郡伊根町字日出６５１番地,2018-04-04T15:00:00.000Z
9000030260101,温江財産区,アツエザイサンク,26465,京都府与謝郡与謝野町字温江９０２番地,2018-04-04T15:00:00.000Z
1000030260117,下山田財産区,シモヤマダザイサンク,26465,京都府与謝郡与謝野町字下山田１１７０番地,2018-04-04T15:00:00.000Z
1000030260109,加悦財産区,カヤザイサンク,26465,京都府与謝郡与謝野町字加悦１０１１番地,2018-04-04T15:00:00.000Z
2000020268020,与謝野町宮津市中学校組合,ヨサノチョウミヤヅシチュウガッコウクミアイ,26465,京都府与謝郡与謝野町字加悦４３３,2018-04-04T15:00:00.000Z
7000030260111,大江山財産区,オオエヤマザイサンク,26465,京都府与謝郡与謝野町字加悦４３３番地,2018-04-04T15:00:00.000Z
2000030260108,加悦奥財産区,カヤオクザイサンク,26465,京都府与謝郡与謝野町字加悦奥２８１番地,2018-04-04T15:00:00.000Z
5000030260113,岩屋財産区,イワヤザイサンク,26465,京都府与謝郡与謝野町字岩屋３０３番地１,2018-04-04T15:00:00.000Z
5000020264652,与謝野町,ヨサノチヨウ,26465,京都府与謝郡与謝野町字岩滝１７９８－１,2018-04-04T15:00:00.000Z
2000020268615,宮津与謝環境組合,ミヤヅヨザカンキョウクミアイ,26465,京都府与謝郡与謝野町字岩滝１７９８番地１,2018-04-04T15:00:00.000Z
3000030260115,四辻財産区,ヨッツジザイサンク,26465,京都府与謝郡与謝野町字幾地１０１３番地２,2018-04-04T15:00:00.000Z
4000030260114,幾地財産区,イクジザイサンク,26465,京都府与謝郡与謝野町字幾地１４８９番地,2018-04-04T15:00:00.000Z
4000030260106,金屋財産区,カナヤザイサンク,26465,京都府与謝郡与謝野町字金屋３０７番地１,2018-04-04T15:00:00.000Z
8000030260110,後野財産区,ウシロノザイサンク,26465,京都府与謝郡与謝野町字後野８６８番地,2018-04-04T15:00:00.000Z
7000030260103,香河財産区,カゴザイサンク,26465,京都府与謝郡与謝野町字香河４２２番地１,2018-04-04T15:00:00.000Z
6000030260112,三河内財産区,ミゴチザイサンク,26465,京都府与謝郡与謝野町字三河内１５７８番地,2018-04-04T15:00:00.000Z
3000030260107,算所財産区,サンジョザイサンク,26465,京都府与謝郡与謝野町字算所５１６番地,2018-04-04T15:00:00.000Z
2000030260116,上山田財産区,カミヤマダザイサンク,26465,京都府与謝郡与謝野町字上山田１１３０番地４,2018-04-04T15:00:00.000Z
9000030260118,石川財産区,イシカワザイサンク,26465,京都府与謝郡与謝野町字石川７５９番地２,2018-04-04T15:00:00.000Z
5000030260105,滝財産区,タキザイサンク,26465,京都府与謝郡与謝野町字滝９７０番地６,2018-04-04T15:00:00.000Z
8000030260102,明石財産区,アケシザイサンク,26465,京都府与謝郡与謝野町字明石１７７９番地１,2018-04-04T15:00:00.000Z
6000030260104,与謝財産区,ヨザザイサンク,26465,京都府与謝郡与謝野町字与謝２６５８番地,2018-04-04T15:00:00.000Z
5000030270005,大阪市都島本通財産区,オオサカシミヤコジマホンドオリザイサンク,27102,大阪府大阪市都島区中野町２丁目１６‐２０,2018-04-04T15:00:00.000Z
6000030270004,大阪市中野町財産区,オオサカシナカノチョウザイサンク,27102,大阪府大阪市都島区中野町２丁目１６‐２０,2018-04-04T15:00:00.000Z
7000030270003,大阪市東野田町財産区,オオサカシヒガシノダマチザイサンク,27102,大阪府大阪市都島区中野町２丁目１６‐２０,2018-04-04T15:00:00.000Z
4000030270006,大阪市花川北之町財産区,オオサカシハナカワキタノチョウザイサンク,27113,大阪府大阪市西淀川区御幣島１丁目２番１０号,2018-04-04T15:00:00.000Z
4000030270022,大阪市南方町財産区,オオサカシミナミカタチョウザイサンク,27114,大阪府大阪市東淀川区豊新２丁目１番４号,2018-04-04T15:00:00.000Z
6000030270020,大阪市国次町財産区,オオサカシクニツグチョウザイサンク,27114,大阪府大阪市東淀川区豊新２丁目１番４号,2018-04-04T15:00:00.000Z
5000030270021,大阪市飛鳥町財産区,オオサカシアスカチョウザイサンク,27114,大阪府大阪市東淀川区豊新２丁目１番４号,2018-04-04T15:00:00.000Z
3000030270023,大阪市山口町財産区,オオサカシヤマグチチョウザイサンク,27114,大阪府大阪市東淀川区豊新２丁目１番４号,2018-04-04T15:00:00.000Z
1000030270017,大阪市南大道町財産区,オオサカシミナミダイドウチョウザイサンク,27114,大阪府大阪市東淀川区豊新２丁目１番４号,2018-04-04T15:00:00.000Z
8000030270019,大阪市豊里町財産区,オオサカシトヨサトチョウザイサンク,27114,大阪府大阪市東淀川区豊新２丁目１番４号,2018-04-04T15:00:00.000Z
2000030270024,大阪市東宮原町財産区,オオサカシヒガシミヤハラチョウザイサンク,27114,大阪府大阪市東淀川区豊新２丁目１番４号,2018-04-04T15:00:00.000Z
9000030270018,大阪市小松町財産区,オオサカシコマツチョウザイサンク,27114,大阪府大阪市東淀川区豊新２丁目１番４号,2018-04-04T15:00:00.000Z
2000030270016,大阪市江口町財産区,オオサカシエグチチョウザイサンク,27114,大阪府大阪市東淀川区豊新２丁目１番４号,2018-04-04T15:00:00.000Z
4000030270030,大阪市巽四条町財産区,オオサカシタツミシジョウチョウザイサンク,27116,大阪府大阪市生野区勝山南３丁目１番１９号,2018-04-04T15:00:00.000Z
6000030270029,大阪市巽大地町財産区,オオサカシタツミオオジチョウザイサンク,27116,大阪府大阪市生野区勝山南３丁目１番１９号,2018-04-04T15:00:00.000Z
3000030270031,大阪市巽伊賀ケ町財産区,オオサカシタツミイカガチョウザイサンク,27116,大阪府大阪市生野区勝山南３丁目１番１９号,2018-04-04T15:00:00.000Z
7000030270028,大阪市中川町財産区,オオサカシナカガワチョウザイサンク,27116,大阪府大阪市生野区勝山南３丁目１番１９号,2018-04-04T15:00:00.000Z
1000030270025,大阪市岡之町財産区,オオサカシオカノチョウザイサンク,27116,大阪府大阪市生野区勝山南３丁目１番１９号,2018-04-04T15:00:00.000Z
8000030270027,大阪市生野田島町財産区,オオサカシイクノタジマチョウザイサンク,27116,大阪府大阪市生野区勝山南３丁目１番１９号,2018-04-04T15:00:00.000Z
2000030270032,大阪市巽西足代町財産区,オオサカシタツミニシアジロチョウザイサンク,27116,大阪府大阪市生野区勝山南３丁目１番１９号,2018-04-04T15:00:00.000Z
9000030270026,大阪市林寺町財産区,オオサカシハヤシジチョウザイサンク,27116,大阪府大阪市生野区勝山南３丁目１番１９号,2018-04-04T15:00:00.000Z
4000030270039,大阪市赤川町財産区,オオサカシアカガワチョウザイサンク,27117,大阪府大阪市旭区大宮１丁目１番１７号,2018-04-04T15:00:00.000Z
6000030270037,大阪市南島町財産区,オオサカシミナミジマチョウザイサンク,27117,大阪府大阪市旭区大宮１丁目１番１７号,2018-04-04T15:00:00.000Z
5000030270038,大阪市中宮町財産区,オオサカシナカミヤチョウザイサンク,27117,大阪府大阪市旭区大宮１丁目１番１７号,2018-04-04T15:00:00.000Z
7000030270036,大阪市上辻町財産区,オオサカシカミツジチョウザイサンク,27117,大阪府大阪市旭区大宮１丁目１番１７号,2018-04-04T15:00:00.000Z
1000030270033,大阪市両国町財産区,オオサカシリョウゴクチョウザイサンク,27117,大阪府大阪市旭区大宮１丁目１番１７号,2018-04-04T15:00:00.000Z
8000030270035,大阪市別所町財産区,オオサカシベッショチョウザイサンク,27117,大阪府大阪市旭区大宮１丁目１番１７号,2018-04-04T15:00:00.000Z
9000030270034,大阪市北清水町財産区,オオサカシキタシミズチョウザイサンク,27117,大阪府大阪市旭区大宮１丁目１番１７号,2018-04-04T15:00:00.000Z
1000030270041,大阪市今福町財産区,オオサカシイマフクチョウザイサンク,27118,大阪府大阪市城東区中央３丁目５番４５号,2018-04-04T15:00:00.000Z
8000030270043,大阪市関目町財産区,オオサカシセキメチョウザイサンク,27118,大阪府大阪市城東区中央３丁目５番４５号,2018-04-04T15:00:00.000Z
9000030270042,大阪市蒲生町財産区,オオサカシガモウチョウザイサンク,27118,大阪府大阪市城東区中央３丁目５番４５号,2018-04-04T15:00:00.000Z
2000030270040,大阪市野江町財産区,オオサカシノエチョウザイサンク,27118,大阪府大阪市城東区中央３丁目５番４５号,2018-04-04T15:00:00.000Z
6000020278726,大阪広域環境施設組合,オオサカコウイキカンキョウシセツクミアイ,27119,大阪府大阪市阿倍野区阿倍野筋１丁目５番１号あべのルシアス１２階,2020-01-30T15:00:00.000Z
7000020278106,大和川右岸水防事務組合,ヤマトガワウガンスイボウジムクミアイ,27120,大阪府大阪市住吉区遠里小野７丁目８番１８号,2018-04-04T15:00:00.000Z
5000030270054,大阪市矢田富田町財産区,オオサカシヤタトンダチョウザイサンク,27121,大阪府大阪市東住吉区東田辺１丁目１３番４号,2018-04-04T15:00:00.000Z
3000030270056,大阪市田辺町財産区,オオサカシタナベチョウザイサンク,27121,大阪府大阪市東住吉区東田辺１丁目１３番４号,2018-04-04T15:00:00.000Z
4000030270055,大阪市矢田枯木町財産区,オオサカシヤタカレキチョウザイサンク,27121,大阪府大阪市東住吉区東田辺１丁目１３番４号,2018-04-04T15:00:00.000Z
6000030270053,大阪市矢田住道町財産区,オオサカシヤタスンジチョウザイサンク,27121,大阪府大阪市東住吉区東田辺１丁目１３番４号,2018-04-04T15:00:00.000Z
7000030270052,大阪市矢田矢田部町財産区,オオサカシヤタヤタベチョウザイサンク,27121,大阪府大阪市東住吉区東田辺１丁目１３番４号,2018-04-04T15:00:00.000Z
3000030270007,大阪市西町財産区,オオサカシニシマチザイサンク,27123,大阪府大阪市淀川区十三東２丁目３番３号,2018-04-04T15:00:00.000Z
4000030270014,大阪市新高北通財産区,オオサカシニイタカキタドオリザイサンク,27123,大阪府大阪市淀川区十三東２丁目３番３号,2018-04-04T15:00:00.000Z
6000030270012,大阪市東雲町財産区,オオサカシシノノメチョウザイサンク,27123,大阪府大阪市淀川区十三東２丁目３番３号,2018-04-04T15:00:00.000Z
5000030270013,大阪市堀上通財産区,オオサカシホリアゲドオリザイサンク,27123,大阪府大阪市淀川区十三東２丁目３番３号,2018-04-04T15:00:00.000Z
3000030270015,大阪市加島町財産区,オオサカシカシマチョウザイサンク,27123,大阪府大阪市淀川区十三東２丁目３番３号,2018-04-04T15:00:00.000Z
7000030270011,大阪市元今里南通財産区,オオサカシモトイマザトミナミドオリザイサンク,27123,大阪府大阪市淀川区十三東２丁目３番３号,2018-04-04T15:00:00.000Z
1000030270009,大阪市十三東之町財産区,オオサカシジュウソウヒガシノチョウザイサンク,27123,大阪府大阪市淀川区十三東２丁目３番３号,2018-04-04T15:00:00.000Z
8000030270010,大阪市東塚本町財産区,オオサカシヒガシツカモトチョウザイサンク,27123,大阪府大阪市淀川区十三東２丁目３番３号,2018-04-04T15:00:00.000Z
2000030270008,大阪市木川西之町財産区,オオサカシキカワニシノチョウザイサンク,27123,大阪府大阪市淀川区十三東２丁目３番３号,2018-04-04T15:00:00.000Z
7000020278122,淀川右岸水防事務組合,ヨドガワウガンスイボウジムクミアイ,27123,大阪府大阪市淀川区新北野１丁目１１番１１号,2018-04-04T15:00:00.000Z
5000030270046,大阪市茨田焼野町財産区,オオサカシマッタヤケノチョウザイサンク,27124,大阪府大阪市鶴見区横堤５丁目４番１９号,2018-04-04T15:00:00.000Z
3000030270048,大阪市茨田諸口町財産区,オオサカシマッタモログチチョウザイサンク,27124,大阪府大阪市鶴見区横堤５丁目４番１９号,2018-04-04T15:00:00.000Z
4000030270047,大阪市茨田横堤町財産区,オオサカシマッタヨコヅツミチョウザイサンク,27124,大阪府大阪市鶴見区横堤５丁目４番１９号,2018-04-04T15:00:00.000Z
6000030270045,大阪市鶴見町財産区,オオサカシツルミチョウザイサンク,27124,大阪府大阪市鶴見区横堤５丁目４番１９号,2018-04-04T15:00:00.000Z
7000030270044,大阪市放出町財産区,オオサカシハナテンチョウザイサンク,27124,大阪府大阪市鶴見区横堤５丁目４番１９号,2018-04-04T15:00:00.000Z
8000030270051,大阪市茨田安田町財産区,オオサカシマッタヤスダチョウザイサンク,27124,大阪府大阪市鶴見区横堤５丁目４番１９号,2018-04-04T15:00:00.000Z
9000030270050,大阪市茨田浜町財産区,オオサカシマッタハマチョウザイサンク,27124,大阪府大阪市鶴見区横堤５丁目４番１９号,2018-04-04T15:00:00.000Z
2000030270049,大阪市茨田大宮町財産区,オオサカシマッタオオミヤチョウザイサンク,27124,大阪府大阪市鶴見区横堤５丁目４番１９号,2018-04-04T15:00:00.000Z
2000020278408,大阪府都市競艇企業団,オオサカフトシキョウテイキギョウダン,27125,大阪府大阪市住之江区泉１丁目１番７１号,2018-04-04T15:00:00.000Z
5000030270062,大阪市長吉長原町財産区,オオサカシナガヨシナガハラチョウザイサンク,27126,大阪府大阪市平野区背戸口３丁目８番１９号,2018-04-04T15:00:00.000Z
3000030270064,大阪市長吉六反町財産区,オオサカシナガヨシロクタンチョウザイサンク,27126,大阪府大阪市平野区背戸口３丁目８番１９号,2018-04-04T15:00:00.000Z
4000030270063,大阪市長吉出戸町財産区,オオサカシナガヨシデトチョウザイサンク,27126,大阪府大阪市平野区背戸口３丁目８番１９号,2018-04-04T15:00:00.000Z
6000030270061,大阪市長吉川辺町財産区,オオサカシナガヨシカワナベチョウザイサンク,27126,大阪府大阪市平野区背戸口３丁目８番１９号,2018-04-04T15:00:00.000Z
7000030270060,大阪市瓜破西之町財産区,オオサカシウリワリニシノチョウザイサンク,27126,大阪府大阪市平野区背戸口３丁目８番１９号,2018-04-04T15:00:00.000Z
1000030270058,大阪市鞍作新家町財産区,オオサカシクラツクリシンケチョウザイサンク,27126,大阪府大阪市平野区背戸口３丁目８番１９号,2018-04-04T15:00:00.000Z
2000030270065,大阪市乾町財産区,オオサカシイヌイチョウザイサンク,27126,大阪府大阪市平野区背戸口３丁目８番１９号,2018-04-04T15:00:00.000Z
9000030270059,大阪市瓜破東之町財産区,オオサカシウリワリヒガシノチョウザイサンク,27126,大阪府大阪市平野区背戸口３丁目８番１９号,2018-04-04T15:00:00.000Z
2000030270057,鞍作・新家・南鞍作町財産区,クラツクリシンケミナミクラツクリチョウザイサンク,27126,大阪府大阪市平野区背戸口３丁目８番１９号,2018-04-04T15:00:00.000Z
8000030270002,大阪市南長柄町財産区,オオサカシミナミナガラチョウザイサンク,27127,大阪府大阪市北区扇町２丁目１番２７号,2018-04-04T15:00:00.000Z
9000030270001,大阪市北長柄町財産区,オオサカシキタナガラチョウザイサンク,27127,大阪府大阪市北区扇町２丁目１番２７号,2018-04-04T15:00:00.000Z
6000020271004,大阪市,オオサカシ,27127,大阪府大阪市北区中之島１丁目３－２０,2018-04-04T15:00:00.000Z
2000020278696,関西広域連合,カンサイコウイキレンゴウ,27127,大阪府大阪市北区中之島５丁目３番５１号大阪府立大阪国際会議場１１Ｆ,2018-04-04T15:00:00.000Z
3000020278670,大阪府後期高齢者医療広域連合,オオサカフコウキコウレイシャイリョウコウイキレンゴウ,27128,大阪府大阪市中央区常盤町１丁目３番８号,2018-04-04T15:00:00.000Z
4000020270008,大阪府,オオサカフ,27128,大阪府大阪市中央区大手前２丁目１－２２,2018-04-04T15:00:00.000Z
2000020278688,大阪広域水道企業団,オオサカコウイキスイドウキギョウダン,27128,大阪府大阪市中央区谷町２丁目３番１２号,2018-04-04T15:00:00.000Z
3000020271403,堺市,サカイシ,27141,大阪府堺市堺区南瓦町３番１号,2018-04-04T15:00:00.000Z
7000020278114,泉州水防事務組合,センシュウスイボウジムクミアイ,27141,大阪府堺市堺区南瓦町３番１号堺市役所土木部内,2018-04-04T15:00:00.000Z
3000030270097,岸和田市池尻財産区,キシワダシイケジリザイサンク,27202,大阪府岸和田市岸城町７－１,2018-04-04T15:00:00.000Z
5000030270070,岸和田市野・藤井・沼財産区,キシワダシノフジイヌマザイサンク,27202,大阪府岸和田市岸城町７－１,2018-04-04T15:00:00.000Z
4000030270088,岸和田市河合財産区,キシワダシカアヒザイサンク,27202,大阪府岸和田市岸城町７－１,2018-04-04T15:00:00.000Z
3000030270114,岸和田市三田・包近・岡山財産区,キシワダシミタカネチカヲカヤマザイサンク,27202,大阪府岸和田市岸城町７－１,2018-04-04T15:00:00.000Z
6000030270086,岸和田市阿間河滝財産区,キシワダシアマカダキザイサンク,27202,大阪府岸和田市岸城町７－１,2018-04-04T15:00:00.000Z
5000030270087,岸和田市阿間河滝・土生滝財産区,キシワダシアマカダキハブタキザイサンク,27202,大阪府岸和田市岸城町７－１,2018-04-04T15:00:00.000Z
4000030270105,岸和田市久米田墓地財産区,キシワダシクメダボチザイサンク,27202,大阪府岸和田市岸城町７－１,2018-04-04T15:00:00.000Z
3000030270130,岸和田市大沢財産区,キシワダシオオサワザイサンク,27202,大阪府岸和田市岸城町７－１,2018-04-04T15:00:00.000Z
6000030270103,岸和田市小松里財産区,キシワダシコマツリザイサンク,27202,大阪府岸和田市岸城町７－１,2018-04-04T15:00:00.000Z
5000030270104,岸和田市小松里・大町財産区,キシワダシコマツリオオマチザイサンク,27202,大阪府岸和田市岸城町７－１,2018-04-04T15:00:00.000Z
6000020272027,岸和田市,キシワダシ,27202,大阪府岸和田市岸城町７－１,2018-04-04T15:00:00.000Z
4000030270121,岸和田市加守・西之内・藤井・別所・野・沼・春木・吉井財産区,キシワダシカモリニシノウチフジイベッショノヌマハルキヨシイザイサンク,27202,大阪府岸和田市岸城町７－１,2018-04-04T15:00:00.000Z
3000030270072,岸和田市土生・作才財産区,キシワダシハブザクザイザイサンク,27202,大阪府岸和田市岸城町７－１,2018-04-04T15:00:00.000Z
6000030270128,岸和田市尾生財産区,キシワダシオブザイサンク,27202,大阪府岸和田市岸城町７－１,2018-04-04T15:00:00.000Z
5000030270120,岸和田市加守財産区,キシワダシカモリザイサンク,27202,大阪府岸和田市岸城町７－１,2018-04-04T15:00:00.000Z
3000030270089,岸和田市河合・白原・神於財産区,キシワダシカアヒシラハラカウノザイサンク,27202,大阪府岸和田市岸城町７－１,2018-04-04T15:00:00.000Z
4000030270071,岸和田市土生財産区,キシワダシハブザイサンク,27202,大阪府岸和田市岸城町７－１,2018-04-04T15:00:00.000Z
3000030270106,岸和田市今木財産区,キシワダシイマキザイサンク,27202,大阪府岸和田市岸城町７－１,2018-04-04T15:00:00.000Z
6000030270078,岸和田市極楽寺・流木・八田財産区,キシワダシゴクラクジナガレギハツタザイサンク,27202,大阪府岸和田市岸城町７－１,2018-04-04T15:00:00.000Z
5000030270079,岸和田市流木財産区,キシワダシナガレギザイサンク,27202,大阪府岸和田市岸城町７－１,2018-04-04T15:00:00.000Z
4000030270096,岸和田市額原財産区,キシワダシガクハラザイサンク,27202,大阪府岸和田市岸城町７－１,2018-04-04T15:00:00.000Z
3000030270122,岸和田市西之内・野・藤井財産区,キシワダシニシノウチノフジイザイサンク,27202,大阪府岸和田市岸城町７－１,2018-04-04T15:00:00.000Z
6000030270094,岸和田市吉井財産区,キシワダシヨシイザイサンク,27202,大阪府岸和田市岸城町７－１,2018-04-04T15:00:00.000Z
5000030270095,岸和田市中井財産区,キシワダシナカイザイサンク,27202,大阪府岸和田市岸城町７－１,2018-04-04T15:00:00.000Z
