corporateID,corporateName,corporateKana,cityID,location,moddate
2000020143421,二宮町,ニノミヤマチ,14342,神奈川県中郡二宮町二宮９６１,2018-04-02T15:00:00.000Z
4000020143618,中井町,ナカイマチ,14361,神奈川県足柄上郡中井町比奈窪５６,2018-04-02T15:00:00.000Z
9000030140030,大井町金田財産区,オオイマチカネタザイサンク,14362,神奈川県足柄上郡大井町金子１９９５,2018-04-02T15:00:00.000Z
2000030140029,大井町西大井財産区,オオイマチニシオオイザイサンク,14362,神奈川県足柄上郡大井町金子１９９５,2018-04-02T15:00:00.000Z
4000020143626,大井町,オオイマチ,14362,神奈川県足柄上郡大井町金子１９９５,2018-04-02T15:00:00.000Z
2000020148296,足柄東部清掃組合,アシガラトウブセイソウクミアイ,14362,神奈川県足柄上郡大井町柳５４０,2018-04-02T15:00:00.000Z
3000020148130,松田町外二ヶ町組合,マツダマチホカニカチョウクミアイ,14363,神奈川県足柄上郡松田町松田惣領２０３７,2018-04-02T15:00:00.000Z
4000020143634,松田町,マツダマチ,14363,神奈川県足柄上郡松田町松田惣領２０３７,2018-04-02T15:00:00.000Z
6000030140033,山北町三保財産区,ヤマキタマチミホザイサンク,14364,神奈川県足柄上郡山北町山北１３０１－４,2018-04-02T15:00:00.000Z
8000030140031,山北町山北財産区,ヤマキタマチヤマキタザイサンク,14364,神奈川県足柄上郡山北町山北１３０１－４,2018-04-02T15:00:00.000Z
7000030140032,山北町共和財産区,ヤマキタマチキヨウワザイサンク,14364,神奈川県足柄上郡山北町山北１３０１－４,2018-04-02T15:00:00.000Z
9000020148075,松田町外三ヶ町組合,マツダマチホカサンカチョウクミアイ,14364,神奈川県足柄上郡山北町山北１３０１－４,2018-04-02T15:00:00.000Z
4000020143642,山北町,ヤマキタマチ,14364,神奈川県足柄上郡山北町山北１３０１－４,2018-04-02T15:00:00.000Z
4000020148377,足柄西部清掃組合,アシガラセイブセイソウクミアイ,14364,神奈川県足柄上郡山北町山北３６８０,2018-04-02T15:00:00.000Z
2000020143669,開成町,カイセイマチ,14366,神奈川県足柄上郡開成町延沢７７３,2018-04-02T15:00:00.000Z
7000020143821,箱根町,ハコネマチ,14382,神奈川県足柄下郡箱根町湯本２５６,2018-04-02T15:00:00.000Z
2000030140037,箱根町蛸川財産区,ハコネマチタコガワザイサンク,14382,神奈川県足柄下郡箱根町湯本２５６番地,2018-04-02T15:00:00.000Z
3000030140036,箱根町仙石原財産区,ハコネマチセンゴクハラザイサンク,14382,神奈川県足柄下郡箱根町湯本２５６番地,2018-04-02T15:00:00.000Z
5000030140034,箱根町温泉財産区,ハコネマチオンセンザイサンク,14382,神奈川県足柄下郡箱根町湯本２５６番地,2018-04-02T15:00:00.000Z
4000030140035,箱根町宮城野財産区,ハコネマチミヤギノザイサンク,14382,神奈川県足柄下郡箱根町湯本２５６番地,2018-04-02T15:00:00.000Z
6000020143839,真鶴町,マナヅルマチ,14383,神奈川県足柄下郡真鶴町岩２４４－１,2018-04-11T15:00:00.000Z
3000020148270,湯河原町真鶴町衛生組合,ユガワラマチマナヅルマチエイセイクミアイ,14384,神奈川県足柄下郡湯河原町吉浜２０２１－９５,2018-04-02T15:00:00.000Z
6000020143847,湯河原町,ユガワラマチ,14384,神奈川県足柄下郡湯河原町中央２丁目２－１,2018-04-02T15:00:00.000Z
6000020144011,愛川町,アイカワマチ,14401,神奈川県愛甲郡愛川町角田２５１－１,2018-04-02T15:00:00.000Z
5000020144029,清川村,キヨカワムラ,14402,神奈川県愛甲郡清川村煤ヶ谷２２１６,2018-04-02T15:00:00.000Z
4000020159069,豊栄郷清掃施設処理組合,トヨサカゴウセイソウシセツショリクミアイ,15101,新潟県新潟市北区浦ノ入４１８番地,2018-04-02T15:00:00.000Z
8000020159271,新潟東港地域水道用水供給企業団,ニイガタヒガシコウチイキスイドウヨウスイキョウキュウキギョウダン,15101,新潟県新潟市北区笹山１１１４番地,2018-04-02T15:00:00.000Z
5000020151009,新潟市,ニイガタシ,15103,新潟県新潟市中央区学校町通１番町６０２番地１,2018-04-02T15:00:00.000Z
5000020150002,新潟県,ニイガタケン,15103,新潟県新潟市中央区新光町４番地１,2020-07-02T15:00:00.000Z
2000020159590,新潟県後期高齢者医療広域連合,ニイガタケンコウキコウレイシャイリョウコウイキレンゴウ,15103,新潟県新潟市中央区新光町４番地１,2018-04-02T15:00:00.000Z
3000020159573,新潟県市町村総合事務組合,ニイガタケンシチョウソンソウゴウジムクミアイ,15103,新潟県新潟市中央区新光町４番地１,2018-04-02T15:00:00.000Z
2000020158551,寺泊老人ホーム組合,テラドマリロウジンホームクミアイ,15202,新潟県長岡市寺泊金山４３２番地,2018-04-02T15:00:00.000Z
7000020152021,長岡市,ナガオカシ,15202,新潟県長岡市大手通１丁目４－１０,2018-04-02T15:00:00.000Z
2000030150003,川口田麦山財産区,カワグチタムギヤマザイサンク,15202,新潟県長岡市大手通１丁目４番地１０,2018-04-02T15:00:00.000Z
4000030150001,村松町財産区,ムラマツマチザイサンク,15202,新潟県長岡市大手通１丁目４番地１０,2018-04-02T15:00:00.000Z
3000030150002,十日町財産区,トオカマチザイサンク,15202,新潟県長岡市大手通１丁目４番地１０,2018-04-02T15:00:00.000Z
5000020158895,新潟県三条・燕総合グラウンド施設組合,ニイガタケンサンジョウツバメソウゴウグラウンドシセツクミアイ,15204,新潟県三条市旭町２丁目３－１,2018-04-02T15:00:00.000Z
5000020152048,三条市,サンジヨウシ,15204,新潟県三条市旭町２丁目３－１,2018-04-02T15:00:00.000Z
9000020158909,三条・燕・西蒲・南蒲広域養護老人ホーム施設組合,サンジョウツバメニシカンナンカンコウイキヨウゴロウジンホームシセツクミアイ,15204,新潟県三条市吉田１２３７番地,2018-04-02T15:00:00.000Z
1000020159352,三条地域水道用水供給企業団,サンジョウチイキスイドウヨウスイキョウキュウキギョウダン,15204,新潟県三条市長野字中土１３６５番地,2018-04-02T15:00:00.000Z
5000020152056,柏崎市,カシワザキシ,15205,新潟県柏崎市日石町２－１,2021-01-25T15:00:00.000Z
1000030150004,新発田市本田財産区,シバタシホンダザイサンク,15206,新潟県新発田市中央町３丁目３番３号,2018-04-02T15:00:00.000Z
5000020152064,新発田市,シバタシ,15206,新潟県新発田市中央町３丁目３番３号,2018-04-02T15:00:00.000Z
9000030150005,新発田市藤塚浜財産区,シバタシフジツカハマザイサンク,15206,新潟県新発田市中央町３丁目３番３号,2018-04-02T15:00:00.000Z
6000020159182,新発田地域老人福祉保健事務組合,シバタチイキロウジンフクシホケンジムクミアイ,15206,新潟県新発田市中央町５丁目４番７号,2020-07-02T15:00:00.000Z
8000020159123,新発田地域広域事務組合,シバタチイキコウイキジムクミアイ,15206,新潟県新発田市中央町５丁目４番７号,2018-04-02T15:00:00.000Z
5000020158607,下越障害福祉事務組合,カエツショウガイフクシジムクミアイ,15206,新潟県新発田市中央町５丁目４番７号,2018-04-02T15:00:00.000Z
4000020152081,小千谷市,オヂヤシ,15208,新潟県小千谷市城内２丁目７番５号,2018-04-02T15:00:00.000Z
3000020152099,加茂市,カモシ,15209,新潟県加茂市幸町２丁目３－５,2018-04-02T15:00:00.000Z
9000020158933,加茂市・田上町消防衛生保育組合,カモシタガミマチショウボウエイセイホイククミアイ,15209,新潟県加茂市幸町２丁目３番５号,2018-04-02T15:00:00.000Z
6000020159166,十日町地域広域事務組合,トオカマチチイキコウイキジムクミアイ,15210,新潟県十日町市四日町新田１０４１,2018-04-02T15:00:00.000Z
9000020152102,十日町市,トオカマチシ,15210,新潟県十日町市千歳町３丁目３,2018-04-02T15:00:00.000Z
8000020152111,見附市,ミツケシ,15211,新潟県見附市昭和町２丁目１－１,2018-04-02T15:00:00.000Z
5000020158623,新潟県中越福祉事務組合,ニイガタケンチュウエツフクシジムクミアイ,15211,新潟県見附市田井町４４７６番地,2018-04-02T15:00:00.000Z
7000020152129,村上市,ムラカミシ,15212,新潟県村上市三之町１－１,2018-04-02T15:00:00.000Z
8000030150006,村上市三面財産区,ムラカミシミオモテザイサンク,15212,新潟県村上市三之町１番１号,2018-04-02T15:00:00.000Z
7000020152137,燕市,ツバメシ,15213,新潟県燕市吉田西太田１９３４番地,2018-04-02T15:00:00.000Z
7000020159000,燕・弥彦総合事務組合,ツバメヤヒコソウゴウジムクミアイ,15213,新潟県燕市吉田浜首４０８番地１,2018-04-02T15:00:00.000Z
7000020152161,糸魚川市,イトイガワシ,15216,新潟県糸魚川市一の宮１丁目２－５,2018-04-02T15:00:00.000Z
6000020152170,妙高市,ミヨウコウシ,15217,新潟県妙高市栄町５－１,2018-04-02T15:00:00.000Z
7000030150007,妙高市杉野沢財産区,ミョウコウシスギノサワザイサンク,15217,新潟県妙高市栄町５番１号,2018-04-02T15:00:00.000Z
3000020159409,新井頸南広域行政組合,アライケイナンコウイキギョウセイクミアイ,15217,新潟県妙高市大字高柳９３１番地１,2018-04-02T15:00:00.000Z
4000020158640,新潟県中東福祉事務組合,ニイガタケンチュウトウフクシジムクミアイ,15218,新潟県五泉市尻上１１８番地,2018-04-02T15:00:00.000Z
5000020152188,五泉市,ゴセンシ,15218,新潟県五泉市太田１０９４番地１,2018-04-02T15:00:00.000Z
6000030150008,川東財産区,カワヒガシザイサンク,15218,新潟県五泉市太田１０９４番地１,2018-04-02T15:00:00.000Z
3000020158542,さくら福祉保健事務組合,サクラフクシホケンジムクミアイ,15218,新潟県五泉市番坂新１７４番地２,2018-04-02T15:00:00.000Z
1000020159476,五泉地域衛生施設組合,ゴセンチイキエイセイシセツクミアイ,15218,新潟県五泉市論瀬８８６４番地,2018-04-02T15:00:00.000Z
6000020159174,上越地域消防事務組合,ジョウエツチイキショウボウジムクミアイ,15222,新潟県上越市大字藤野新田３３０番地１,2021-03-09T15:00:00.000Z
5000020159522,上越広域伝染病院組合,ジョウエツコウイキデンセンビョウインクミアイ,15222,新潟県上越市木田１丁目１番３号,2018-04-02T15:00:00.000Z
9000020152226,上越市,ジヨウエツシ,15222,新潟県上越市木田１丁目１番３号,2018-04-02T15:00:00.000Z
2000030150011,押切外四ヶ大字財産区,オシキリホカヨンカオオアザザイサンク,15223,新潟県阿賀野市岡山町１０番１５号,2018-04-02T15:00:00.000Z
3000030150010,大室財産区,オオムロザイサンク,15223,新潟県阿賀野市岡山町１０番１５号,2018-04-02T15:00:00.000Z
5000030150009,大字保田財産区,オオアザヤスダザイサンク,15223,新潟県阿賀野市岡山町１０番１５号,2018-04-02T15:00:00.000Z
9000020152234,阿賀野市,アガノシ,15223,新潟県阿賀野市岡山町１０番１５号,2018-04-02T15:00:00.000Z
1000020159484,阿賀北広域組合,アガキタコウイキクミアイ,15223,新潟県阿賀野市船居字権九郎新田４９６番地１,2018-04-02T15:00:00.000Z
5000030150017,松ヶ崎財産区,マツガサキザイサンク,15224,新潟県佐渡市千種２３２,2018-04-02T15:00:00.000Z
1000030150012,五十里財産区,イカリザイサンク,15224,新潟県佐渡市千種２３２,2018-04-02T15:00:00.000Z
8000030150014,新畑野財産区,シンハタノザイサンク,15224,新潟県佐渡市千種２３２,2018-04-02T15:00:00.000Z
3000030150019,河内財産区,カワチザイサンク,15224,新潟県佐渡市千種２３２,2018-04-02T15:00:00.000Z
4000030150018,畑野財産区,ハタノザイサンク,15224,新潟県佐渡市千種２３２,2018-04-02T15:00:00.000Z
6000030150016,目黒町財産区,メグロマチザイサンク,15224,新潟県佐渡市千種２３２,2018-04-02T15:00:00.000Z
7000030150015,真野財産区,マノザイサンク,15224,新潟県佐渡市千種２３２,2018-04-02T15:00:00.000Z
9000020152242,佐渡市,サドシ,15224,新潟県佐渡市千種２３２,2018-04-02T15:00:00.000Z
9000030150013,二宮財産区,ニクウザイサンク,15224,新潟県佐渡市千種２３２,2018-04-02T15:00:00.000Z
5000020158615,魚沼地区障害福祉組合,ウオヌマチクショウガイフクシクミアイ,15225,新潟県魚沼市十日町１４０３番地１,2018-04-02T15:00:00.000Z
8000020152251,魚沼市,ウオヌマシ,15225,新潟県魚沼市小出島１３０－１,2018-04-02T15:00:00.000Z
1000020159336,魚沼地域特別養護老人ホーム組合,ウオヌマチイキトクベツヨウゴロウジンホームクミアイ,15226,新潟県南魚沼市浦佐４０５９番地１,2018-04-02T15:00:00.000Z
7000020152269,南魚沼市,ミナミウオヌマシ,15226,新潟県南魚沼市六日町１８０－１,2018-04-02T15:00:00.000Z
2000030150028,大字四十日、北田中、宇津野新田、青木新田、大杉新田財産区,オオアザシトカキタタナカウツノシンデンアオキシンデンオオスギシンデンザイサンク,15226,新潟県南魚沼市六日町１８０番地１,2018-04-02T15:00:00.000Z
1000030150020,大字四十日財産区,オオアザシトカザイサンク,15226,新潟県南魚沼市六日町１８０番地１,2018-04-02T15:00:00.000Z
4000030150026,大字大杉新田財産区,オオアザオオスギシンデンザイサンク,15226,新潟県南魚沼市六日町１８０番地１,2018-04-02T15:00:00.000Z
3000030150027,大字川窪財産区,オオアザカワクボザイサンク,15226,新潟県南魚沼市六日町１８０番地１,2018-04-02T15:00:00.000Z
5000030150025,大字寺尾財産区,オオアザテラオザイサンク,15226,新潟県南魚沼市六日町１８０番地１,2018-04-02T15:00:00.000Z
8000030150030,大字四十日、北田中財産区,オオアザシトカキタタナカザイサンク,15226,新潟県南魚沼市六日町１８０番地１,2018-04-02T15:00:00.000Z
4000030150034,大字塩沢財産区,オオアザシオザワザイサンク,15226,新潟県南魚沼市六日町１８０番地１,2018-04-02T15:00:00.000Z
1000030150029,大字欠之上財産区,オオアザカケノウエザイサンク,15226,新潟県南魚沼市六日町１８０番地１,2018-04-02T15:00:00.000Z
5000030150033,大字大月財産区,オオアザオオヅキザイサンク,15226,新潟県南魚沼市六日町１８０番地１,2018-04-02T15:00:00.000Z
8000030150022,大字野田財産区,オオアザノダザイサンク,15226,新潟県南魚沼市六日町１８０番地１,2018-04-02T15:00:00.000Z
7000030150031,大字泉新田財産区,オオアザイズミシンデンザイサンク,15226,新潟県南魚沼市六日町１８０番地１,2018-04-02T15:00:00.000Z
6000030150024,大字五日町財産区,オオアザイツカマチザイサンク,15226,新潟県南魚沼市六日町１８０番地１,2018-04-02T15:00:00.000Z
7000030150023,大字奥財産区,オオアザオクザイサンク,15226,新潟県南魚沼市六日町１８０番地１,2018-04-02T15:00:00.000Z
6000030150032,大字坂戸、六日町財産区,オオアザサカドムイカマチザイサンク,15226,新潟県南魚沼市六日町１８０番地１,2018-04-02T15:00:00.000Z
9000030150021,大字北田中財産区,オオアザキタタナカザイサンク,15226,新潟県南魚沼市六日町１８０番地１,2018-04-02T15:00:00.000Z
7000020152277,胎内市,タイナイシ,15227,新潟県胎内市新和町２－１０,2018-04-02T15:00:00.000Z
3000030150035,村松浜財産区,ムラマツハマザイサンク,15227,新潟県胎内市村松浜１０５８番地,2018-04-02T15:00:00.000Z
5000020153079,聖籠町,セイロウマチ,15307,新潟県北蒲原郡聖籠町大字諏訪山１６３５－４,2018-04-02T15:00:00.000Z
4000020153427,弥彦村,ヤヒコムラ,15342,新潟県西蒲原郡弥彦村大字矢作４０２,2018-04-02T15:00:00.000Z
5000020158631,西蒲原福祉事務組合,ニシカンバラフクシジムクミアイ,15342,新潟県西蒲原郡弥彦村大字麓６９５８番地,2018-04-02T15:00:00.000Z
8000020153613,田上町,タガミマチ,15361,新潟県南蒲原郡田上町大字原ケ崎新田３０７０,2018-04-02T15:00:00.000Z
9000020153851,阿賀町,アガマチ,15385,新潟県東蒲原郡阿賀町津川５８０,2018-04-02T15:00:00.000Z
7000020154059,出雲崎町,イズモザキマチ,15405,新潟県三島郡出雲崎町大字川西１４０,2018-04-02T15:00:00.000Z
9000020154610,湯沢町,ユザワマチ,15461,新潟県南魚沼郡湯沢町大字神立３００,2018-04-02T15:00:00.000Z
7000020158381,津南地域衛生施設組合,ツナンチイキエイセイシセツクミアイ,15482,新潟県中魚沼郡津南町大字下船渡戊２０１３番地,2018-04-02T15:00:00.000Z
3000020154822,津南町,ツナンマチ,15482,新潟県中魚沼郡津南町大字下船渡戊５８５,2018-04-02T15:00:00.000Z
9000020155047,刈羽村,カリワムラ,15504,新潟県刈羽郡刈羽村大字割町新田２１５－１,2018-04-02T15:00:00.000Z
4000020155811,関川村,セキカワムラ,15581,新潟県岩船郡関川村大字下関９１２,2018-04-02T15:00:00.000Z
3000020155861,粟島浦村,アワシマウラムラ,15586,新潟県岩船郡粟島浦村字日ノ見山１５１３－１１,2018-04-02T15:00:00.000Z
1000020169013,富山県市町村会館管理組合,トヤマケンシチョウソンカイカンカンリクミアイ,16201,富山県富山市下野９９５番地の３（市町村会館内,2018-04-02T15:00:00.000Z
9000020168726,富山県市町村総合事務組合,トヤマケンシチョウソンソウゴウジムクミアイ,16201,富山県富山市下野９９５番地の３市町村会館内,2018-04-02T15:00:00.000Z
9000020162019,富山市,トヤマシ,16201,富山県富山市新桜町７番３８号,2018-04-02T15:00:00.000Z
7000020160008,富山県,トヤマケン,16201,富山県富山市新総曲輪１番７号,2018-04-02T15:00:00.000Z
1000020168114,三郷利田用水市町村組合,サンゴウリタヨウスイシチョウソンクミアイ,16201,富山県富山市水橋小路１７番地,2018-04-02T15:00:00.000Z
1000020169129,富山県後期高齢者医療広域連合,トヤマケンコウキコウレイシャイリョウコウイキレンゴウ,16201,富山県富山市婦中町速星７５４番地富山市婦中行政サービスセンター５Ｆ,2018-04-02T15:00:00.000Z
9000020162027,高岡市,タカオカシ,16202,富山県高岡市広小路７番５０号,2018-04-15T15:00:00.000Z
8000020168611,庄川水害予防組合,ショウガワスイガイヨボウクミアイ,16202,富山県高岡市広小路７番５０号高岡市都市創造部土木維持課内,2018-04-15T15:00:00.000Z
5000020168424,砺波地方衛生施設組合,トナミチホウエイセイシセツクミアイ,16202,富山県高岡市福岡町土屋７１０番地,2018-04-02T15:00:00.000Z
9000020162043,魚津市,ウオヅシ,16204,富山県魚津市釈迦堂１丁目１０番１号,2018-04-02T15:00:00.000Z
3000020168921,新川広域圏事務組合,ニイカワコウイキケンジムクミアイ,16204,富山県魚津市北鬼江３１３番２魚津市役所第一分庁舎内,2018-04-02T15:00:00.000Z
1000020169145,富山県東部消防組合,トヤマケントウブショウボウクミアイ,16204,富山県魚津市本江３１９７番地１,2018-04-02T15:00:00.000Z
3000030160001,氷見市南中財産区,ヒミシミナミナカザイサンク,16205,富山県氷見市鞍川１０６０番地,2018-04-02T15:00:00.000Z
9000020162051,氷見市,ヒミシ,16205,富山県氷見市鞍川１０６０番地,2018-04-02T15:00:00.000Z
2000030160002,氷見市南下財産区,ヒミシミナミシモザイサンク,16205,富山県氷見市鞍川１０６０番地,2018-04-02T15:00:00.000Z
1000020169005,高岡地区広域圏事務組合,タカオカチクコウイキケンジムクミアイ,16205,富山県氷見市上田子字笹谷内５０番地,2018-04-02T15:00:00.000Z
2000020169111,滑川中新川地区広域情報事務組合,ナメリカワナカニイカワチクコウイキジョウホウジムクミアイ,16206,富山県滑川市開６７６番地滑川市ＳＯＨＯセンター内,2018-04-02T15:00:00.000Z
9000030160004,滑川市東加積財産区,ナメリカワシヒガシカヅミザイサンク,16206,富山県滑川市寺家町１０４番地,2018-04-15T15:00:00.000Z
8000020162060,滑川市,ナメリカワシ,16206,富山県滑川市寺家町１０４番地,2018-04-08T15:00:00.000Z
1000030160003,滑川市高月財産区,ナメリカワシタカツキザイサンク,16206,富山県滑川市寺家町１０４番地,2018-04-15T15:00:00.000Z
5000030160008,黒部市宇奈月町浦山財産区,クロベシウナヅキマチウラヤマザイサンク,16207,富山県黒部市宇奈月町浦山８７９番地１,2018-04-02T15:00:00.000Z
6000030160007,黒部市宇奈月町音沢財産区,クロベシウナヅキマチオトザワザイサンク,16207,富山県黒部市宇奈月町音澤７０２番地２,2018-04-02T15:00:00.000Z
1000030160011,黒部市宇奈月町下立財産区,クロベシウナヅキマチオリタテザイサンク,16207,富山県黒部市宇奈月町下立６９８番地１,2018-04-02T15:00:00.000Z
4000030160009,黒部市宇奈月町栃屋財産区,クロベシウナヅキマチトチヤザイサンク,16207,富山県黒部市宇奈月町栃屋１６４６番地,2018-04-02T15:00:00.000Z
7000030160006,黒部市宇奈月町内山財産区,クロベシウナヅキマチウチヤマザイサンク,16207,富山県黒部市宇奈月町内山１２６０番地,2018-04-02T15:00:00.000Z
2000030160010,黒部市宇奈月町愛本財産区,クロベシウナヅキマチアイモトザイサンク,16207,富山県黒部市宇奈月町内山３３５３番地,2018-04-02T15:00:00.000Z
7000020162078,黒部市,クロベシ,16207,富山県黒部市三日市１３０１番地,2018-04-02T15:00:00.000Z
8000030160005,黒部市東布施財産区,クロベシヒガシフセザイサンク,16207,富山県黒部市釈迦堂９２３番地,2018-04-02T15:00:00.000Z
1000020169153,新川地域消防組合,ニイカワチイキショウボウクミアイ,16207,富山県黒部市植木７６１番地１,2018-04-02T15:00:00.000Z
6000020169099,新川地域介護保険・ケーブルテレビ事業組合,ニイカワチイキカイゴホケンケーブルテレビジギョウクミアイ,16207,富山県黒部市北新１９９番地,2018-04-02T15:00:00.000Z
7000020162086,砺波市,トナミシ,16208,富山県砺波市栄町７番３号,2018-04-02T15:00:00.000Z
8000020169072,砺波地方介護保険組合,トナミチホウカイゴホケンクミアイ,16208,富山県砺波市栄町７番３号砺波市高齢者能力活用センター,2018-04-02T15:00:00.000Z
4000020168912,砺波広域圏事務組合,トナミコウイキケンジムクミアイ,16208,富山県砺波市庄川町青島４０１,2021-04-21T15:00:00.000Z
1000020169137,砺波地域消防組合,トナミチイキショウボウクミアイ,16208,富山県砺波市大辻５０１番地,2018-04-02T15:00:00.000Z
7000020162094,小矢部市,オヤベシ,16209,富山県小矢部市本町１番１号,2018-04-02T15:00:00.000Z
7000020168645,小矢部川中流水害予防組合,オヤベガワチュウリュウスイガイヨボウクミアイ,16209,富山県小矢部市本町１番１号小矢部市役所内,2018-04-15T15:00:00.000Z
2000020162108,南砺市,ナントシ,16210,富山県南砺市苗島４８８０番地,2018-04-02T15:00:00.000Z
2000020162116,射水市,イミズシ,16211,富山県射水市新開発４１０番地１,2018-04-02T15:00:00.000Z
7000020168629,庄川右岸水害予防組合,ショウガワウガンスイガイヨボウクミアイ,16211,富山県射水市二口１０８１番地射水市役所大門庁舎,2018-04-02T15:00:00.000Z
8000020169048,中新川広域行政事務組合,ナカニイカワコウイキギョウセイジムクミアイ,16321,富山県中新川郡舟橋村国重２４２番地,2018-04-02T15:00:00.000Z
5000020163210,舟橋村,フナハシムラ,16321,富山県中新川郡舟橋村佛生寺５５番地,2018-04-02T15:00:00.000Z
4000020163228,上市町,カミイチマチ,16322,富山県中新川郡上市町法音寺１番地,2018-04-02T15:00:00.000Z
4000020163236,立山町,タテヤママチ,16323,富山県中新川郡立山町前沢２４４０番地,2018-04-02T15:00:00.000Z
7000020168661,常願寺川右岸水防市町村組合,ジョウガンジガワウガンスイボウシチョウソンクミアイ,16323,富山県中新川郡立山町前沢２４４０番地,2018-04-02T15:00:00.000Z
2000020168971,富山地区広域圏事務組合,トヤマチクコウイキケンジムクミアイ,16323,富山県中新川郡立山町末三賀１０３番地３,2018-04-02T15:00:00.000Z
8000020163422,入善町,ニュウゼンマチ,16342,富山県下新川郡入善町入膳３２５５番地,2018-04-02T15:00:00.000Z
