corporateID,corporateName,corporateKana,cityID,location,moddate
9000020318388,鳥取県後期高齢者医療広域連合,トットリケンコウキコウレイシャイリョウコウイキレンゴウ,31370,鳥取県東伯郡湯梨浜町大字龍島５００番地（湯梨浜町役場東郷庁舎２階）,2018-04-08T15:00:00.000Z
2000020313718,琴浦町,コトウラチヨウ,31371,鳥取県東伯郡琴浦町大字徳万５９１－２,2018-04-08T15:00:00.000Z
5000030310124,琴浦町上郷財産区,コトウラチョウカミゴウザイサンク,31371,鳥取県東伯郡琴浦町大字徳万５９１番地２,2018-04-08T15:00:00.000Z
6000030310123,琴浦町下郷財産区,コトウラチョウシモゴウザイサンク,31371,鳥取県東伯郡琴浦町大字徳万５９１番地２,2018-04-08T15:00:00.000Z
4000030310125,琴浦町古布庄財産区,コトウラチョウコウノショウザイサンク,31371,鳥取県東伯郡琴浦町大字徳万５９１番地２,2018-04-08T15:00:00.000Z
8000030310121,琴浦町八橋財産区,コトウラチョウヤバセザイサンク,31371,鳥取県東伯郡琴浦町大字徳万５９１番地２,2018-04-08T15:00:00.000Z
2000030310127,琴浦町成美財産区,コトウラチョウナルミザイサンク,31371,鳥取県東伯郡琴浦町大字徳万５９１番地２,2018-04-08T15:00:00.000Z
9000030310129,琴浦町以西財産区,コトウラチョウイサイザイサンク,31371,鳥取県東伯郡琴浦町大字徳万５９１番地２,2018-04-08T15:00:00.000Z
3000030310126,琴浦町赤碕財産区,コトウラチョウアカサキザイサンク,31371,鳥取県東伯郡琴浦町大字徳万５９１番地２,2018-04-08T15:00:00.000Z
1000030310128,琴浦町安田財産区,コトウラチョウヤスダザイサンク,31371,鳥取県東伯郡琴浦町大字徳万５９１番地２,2018-04-08T15:00:00.000Z
7000030310122,琴浦町浦安財産区,コトウラチョウウラヤスザイサンク,31371,鳥取県東伯郡琴浦町大字徳万５９１番地２,2018-04-08T15:00:00.000Z
2000020318353,鳥取中部ふるさと広域連合,トットリチュウブフルサトコウイキレンゴウ,31372,鳥取県東伯郡北栄町土下１１２番地,2018-04-08T15:00:00.000Z
2000020313726,北栄町,ホクエイチヨウ,31372,鳥取県東伯郡北栄町由良宿４２３－１,2018-04-08T15:00:00.000Z
7000030310130,栄財産区,サカエザイサンク,31372,鳥取県東伯郡北栄町由良宿４２３番地１,2018-04-08T15:00:00.000Z
3000020313840,日吉津村,ヒエヅソン,31384,鳥取県西伯郡日吉津村大字日吉津８７２－１５,2018-04-08T15:00:00.000Z
6000030310131,中山財産区,ナカヤマザイサンク,31386,鳥取県西伯郡大山町御来屋３２８,2018-04-08T15:00:00.000Z
3000030310134,逢坂財産区,オウサカザイサンク,31386,鳥取県西伯郡大山町御来屋３２８,2018-04-08T15:00:00.000Z
5000030310132,上中山財産区,カミナカヤマザイサンク,31386,鳥取県西伯郡大山町御来屋３２８,2018-04-08T15:00:00.000Z
4000030310133,下中山財産区,シモナカヤマザイサンク,31386,鳥取県西伯郡大山町御来屋３２８,2018-04-08T15:00:00.000Z
2000020313866,大山町,ダイセンチヨウ,31386,鳥取県西伯郡大山町御来屋３２８,2018-04-08T15:00:00.000Z
2000030310135,東長田財産区,ヒガシナガタザイサンク,31389,鳥取県西伯郡南部町法勝寺３７７－１,2018-04-08T15:00:00.000Z
1000020313891,南部町,ナンブチヨウ,31389,鳥取県西伯郡南部町法勝寺３７７－１,2018-04-08T15:00:00.000Z
9000020318256,南部町・伯耆町清掃施設管理組合,ナンブチョウホウキチョウセイソウシセツカンリクミアイ,31389,鳥取県西伯郡南部町法勝寺３７７－１（南部町役場内）,2018-04-08T15:00:00.000Z
1000020318370,南部箕蚊屋広域連合,ナンブミノカヤコウイキレンゴウ,31389,鳥取県西伯郡南部町法勝寺３７７－１（南部町役場内）,2018-04-08T15:00:00.000Z
6000020313904,伯耆町,ホウキチヨウ,31390,鳥取県西伯郡伯耆町吉長３７－３,2018-04-08T15:00:00.000Z
3000020314013,日南町,ニチナンチヨウ,31401,鳥取県日野郡日南町霞８００,2018-04-08T15:00:00.000Z
3000020314021,日野町,ヒノチヨウ,31402,鳥取県日野郡日野町根雨１０１,2018-04-08T15:00:00.000Z
2000020318345,日野病院組合,ヒノビョウインクミアイ,31402,鳥取県日野郡日野町野田３３２,2018-04-08T15:00:00.000Z
8000030310138,米沢財産区,ヨネザワザイサンク,31403,鳥取県日野郡江府町大字江尾４７５,2018-04-08T15:00:00.000Z
9000030310137,神奈川財産区,カナガワザイサンク,31403,鳥取県日野郡江府町大字江尾４７５,2018-04-08T15:00:00.000Z
1000030310136,江尾財産区,エビザイサンク,31403,鳥取県日野郡江府町大字江尾４７５,2018-04-08T15:00:00.000Z
2000020314030,江府町,コウフチヨウ,31403,鳥取県日野郡江府町大字江尾４７５,2018-04-08T15:00:00.000Z
9000020318124,日野町江府町日南町衛生施設組合,ヒノチョウコウフチョウニチナンチョウエイセイシセツクミアイ,31403,鳥取県日野郡江府町大字江尾４７５（江府町役場内）,2018-04-08T15:00:00.000Z
1000020320005,島根県,シマネケン,32201,島根県松江市殿町１,2018-04-08T15:00:00.000Z
4000020328961,島根県後期高齢者医療広域連合,シマネケンコウキコウレイシャイリョウコウイキレンゴウ,32201,島根県松江市殿町８－３,2018-04-08T15:00:00.000Z
3000020328847,島根県市町村総合事務組合,シマネケンシチョウソンソウゴウジムクミアイ,32201,島根県松江市殿町８－３,2018-04-08T15:00:00.000Z
3000020322016,松江市,マツエシ,32201,島根県松江市末次町８６,2018-04-08T15:00:00.000Z
3000030320001,松江市恵曇財産区,マツエシエトモザイサンク,32201,島根県松江市末次町８６番地,2018-04-08T15:00:00.000Z
1000030320003,松江市御津財産区,マツエシミツザイサンク,32201,島根県松江市末次町８６番地,2018-04-08T15:00:00.000Z
9000030320004,松江市佐太財産区,マツエシサタザイサンク,32201,島根県松江市末次町８６番地,2018-04-08T15:00:00.000Z
2000030320002,松江市講武財産区,マツエシコウブザイサンク,32201,島根県松江市末次町８６番地,2018-04-08T15:00:00.000Z
3000020322024,浜田市,ハマダシ,32202,島根県浜田市殿町１,2018-04-08T15:00:00.000Z
8000030320005,美川区有財産管理組合,ミカワクユウザイサンカンリクミアイ,32202,島根県浜田市内村町５９３－３,2018-04-08T15:00:00.000Z
3000020322032,出雲市,イズモシ,32203,島根県出雲市今市町７０,2018-04-08T15:00:00.000Z
5000020328341,斐川宍道水道企業団,ヒカワシンジスイドウキギョウダン,32203,島根県出雲市斐川町上庄原１７４９－１,2018-04-08T15:00:00.000Z
2000020322041,益田市,マスダシ,32204,島根県益田市常盤町１－１,2018-04-08T15:00:00.000Z
8000020328529,益田地区広域市町村圏事務組合,マスダチクコウイキシチョウソンケンジムクミアイ,32204,島根県益田市常盤町１－１,2018-04-08T15:00:00.000Z
7000030320006,匹見財産区,ヒキミザイサンク,32204,島根県益田市常盤町１番１号,2018-04-08T15:00:00.000Z
1000020322059,大田市,オオダシ,32205,島根県大田市大田町大田ロ１１１１,2018-04-08T15:00:00.000Z
1000020322067,安来市,ヤスギシ,32206,島根県安来市安来町８７８－２,2018-04-08T15:00:00.000Z
4000030320009,赤屋財産区,アカヤザイサンク,32206,島根県安来市安来町８７８番地２,2018-04-08T15:00:00.000Z
6000030320007,母里財産区,モリザイサンク,32206,島根県安来市安来町８７８番地２,2018-04-08T15:00:00.000Z
5000030320008,井尻財産区,イジリザイサンク,32206,島根県安来市安来町８７８番地２,2018-04-08T15:00:00.000Z
1000020322075,江津市,ゴウツシ,32207,島根県江津市江津町１０１６番地４,2021-05-23T15:00:00.000Z
1000020328642,浜田市江津市旧有福村有財産共同管理組合,ハマダシゴウツシキュウアリフクソンユウザイサンキョウドウカンリクミアイ,32207,島根県江津市江津町１５２５,2018-04-08T15:00:00.000Z
8000020328553,江津邑智消防組合,ゴウツオオチショウボウクミアイ,32207,島根県江津市渡津町９６１－１９,2018-04-08T15:00:00.000Z
6000020328910,浜田地区広域行政組合,ハマダチクコウイキギョウセイクミアイ,32207,島根県江津市波子町ロ３２１－１,2018-04-08T15:00:00.000Z
1000020328766,雲南市・飯南町事務組合,ウンナンシイイナンチョウジムクミアイ,32209,島根県雲南市掛合町掛合１２６１－３,2018-04-08T15:00:00.000Z
5000020328936,雲南広域連合,ウンナンコウイキレンゴウ,32209,島根県雲南市木次町里方１１００－６,2018-04-08T15:00:00.000Z
2000030320010,雲南市財産区,ウンナンシザイサンク,32209,島根県雲南市木次町里方５２１番地１,2018-04-08T15:00:00.000Z
1000020322091,雲南市,ウンナンシ,32209,島根県雲南市木次町里方５２１番地１,2018-04-08T15:00:00.000Z
9000030320012,奥出雲町三沢財産区,オクイズモチョウミザワザイサンク,32343,島根県仁多郡奥出雲町河内１２２０－１１、１５８４－２,2018-04-08T15:00:00.000Z
9000020323438,奥出雲町,オクイズモチヨウ,32343,島根県仁多郡奥出雲町三成３５８－１,2018-04-08T15:00:00.000Z
1000030320011,奥出雲町布勢財産区,オクイズモチョウフセザイサンク,32343,島根県仁多郡奥出雲町八代１２４１－１、１６８５－１、１６８５－５、１６８５－６、１６８５－７、１６８５－８、１６８５－１２,2018-04-08T15:00:00.000Z
6000020323861,飯南町,イイナンチヨウ,32386,島根県飯石郡飯南町下赤名８８０,2018-04-08T15:00:00.000Z
2000020324418,川本町,カワモトマチ,32441,島根県邑智郡川本町大字川本２７１－３,2018-04-08T15:00:00.000Z
2000020328880,邑智郡総合事務組合,オオチグンソウゴウジムクミアイ,32441,島根県邑智郡川本町大字川本３３２－１５,2018-04-08T15:00:00.000Z
9000020324485,美郷町,ミサトチヨウ,32448,島根県邑智郡美郷町粕渕１６８,2018-04-08T15:00:00.000Z
3000020328871,邑智郡公立病院組合,オオチグンコウリツビョウインクミアイ,32449,島根県邑智郡邑南町中野３８４８－２,2018-04-08T15:00:00.000Z
9000020324493,邑南町,オオナンチヨウ,32449,島根県邑智郡邑南町矢上６０００,2018-04-08T15:00:00.000Z
7000020325015,津和野町,ツワノチヨウ,32501,島根県鹿足郡津和野町日原５４－２５,2018-04-08T15:00:00.000Z
8000020328413,鹿足郡事務組合,カノアシグンジムクミアイ,32501,島根県鹿足郡津和野町日原５４－２５,2020-08-05T15:00:00.000Z
2000020328740,鹿足郡不燃物処理組合,カノアシグンフネンブツショリクミアイ,32505,島根県鹿足郡吉賀町六日市７５０,2020-08-05T15:00:00.000Z
8000020328421,鹿足郡養護老人ホーム組合,カノアシグンヨウゴロウジンホームクミアイ,32505,島根県鹿足郡吉賀町六日市７５０,2020-08-05T15:00:00.000Z
5000020325058,吉賀町,ヨシカチヨウ,32505,島根県鹿足郡吉賀町六日市７５０,2018-04-08T15:00:00.000Z
9000020325252,海士町,アマチヨウ,32525,島根県隠岐郡海士町大字海士１４９０,2018-04-08T15:00:00.000Z
8000020325261,西ノ島町,ニシノシマチヨウ,32526,島根県隠岐郡西ノ島町大字浦郷５３４,2018-04-08T15:00:00.000Z
6000020328456,島前町村組合,ドウゼンチョウソンクミアイ,32526,島根県隠岐郡西ノ島町大字美田２０７１－１,2020-08-05T15:00:00.000Z
7000020325279,知夫村,チブムラ,32527,島根県隠岐郡知夫村１０６５,2018-04-08T15:00:00.000Z
7000020325287,隠岐の島町,オキノシマチヨウ,32528,島根県隠岐郡隠岐の島町下西７８番地２,2021-08-31T15:00:00.000Z
8000030320013,隠岐の島町中財産区,オキノシマチョウナカザイサンク,32528,島根県隠岐郡隠岐の島町中村１５４１番地４,2018-04-08T15:00:00.000Z
5000020328944,隠岐広域連合,オキコウイキレンゴウ,32528,島根県隠岐郡隠岐の島町都万２０１６,2018-04-08T15:00:00.000Z
5000020338605,岡山市久米南町国民健康保険病院組合,オカヤマシクメナンチョウコクミンケンコウホケンビョウインクミアイ,33101,岡山県岡山市北区建部町福渡１０００,2018-04-08T15:00:00.000Z
3000020338516,旭川中部衛生施設組合,アサヒガワチュウブエイセイシセツクミアイ,33101,岡山県岡山市北区御津鹿瀬６５０,2018-04-08T15:00:00.000Z
3000020339555,岡山県市町村総合事務組合,オカヤマケンシチョウソンソウゴウジムクミアイ,33101,岡山県岡山市北区今２丁目２－１,2018-04-08T15:00:00.000Z
3000020339571,岡山県後期高齢者医療広域連合,オカヤマケンコウキコウレイシャイリョウコウイキレンゴウ,33101,岡山県岡山市北区今２丁目２－１,2018-04-08T15:00:00.000Z
5000020338869,岡山県市町村税整理組合,オカヤマケンシチョウソンゼイセイリクミアイ,33101,岡山県岡山市北区今２丁目２－１,2018-04-08T15:00:00.000Z
7000030330095,西大寺浜財産区,サイダイジハマザイサンク,33101,岡山県岡山市北区大供１丁目１－１,2018-04-08T15:00:00.000Z
2000030330067,北長瀬財産区,キタナガセザイサンク,33101,岡山県岡山市北区大供１丁目１－１,2018-04-08T15:00:00.000Z
7000030330228,東古松財産区（東古松村総持）,ヒガシフルマツザイサンクヒガシフルマツソンソウモチ,33101,岡山県岡山市北区大供１丁目１－１,2018-04-08T15:00:00.000Z
7000030330137,高塚財産区,タカツカザイサンク,33101,岡山県岡山市北区大供１丁目１－１,2018-04-08T15:00:00.000Z
2000030330166,寺山財産区,テラヤマザイサンク,33101,岡山県岡山市北区大供１丁目１－１,2018-04-08T15:00:00.000Z
2000030330281,湯迫財産区,ユバザイサンク,33101,岡山県岡山市北区大供１丁目１－１,2018-04-08T15:00:00.000Z
2000030330208,日応寺財産区,ニチオウジザイサンク,33101,岡山県岡山市北区大供１丁目１－１,2018-04-08T15:00:00.000Z
3000030330215,畑鮎財産区（大字玉柏平瀬組）,ハタアユザイサンクオオアザタマガシヒラセグミ,33101,岡山県岡山市北区大供１丁目１－１,2018-04-08T15:00:00.000Z
1000030330002,飽浦財産区,アクラザイサンク,33101,岡山県岡山市北区大供１丁目１－１,2018-04-08T15:00:00.000Z
3000030330132,妹尾崎財産区,セノオザキザイサンク,33101,岡山県岡山市北区大供１丁目１－１,2018-04-08T15:00:00.000Z
2000030330100,沢田財産区,サワダザイサンク,33101,岡山県岡山市北区大供１丁目１－１,2018-04-08T15:00:00.000Z
3000030330058,神崎町外１１財産区,カンザキチョウホカジュウイチザイサンク,33101,岡山県岡山市北区大供１丁目１－１,2018-04-08T15:00:00.000Z
7000030330236,広谷財産区,ヒロタニザイサンク,33101,岡山県岡山市北区大供１丁目１－１,2018-04-08T15:00:00.000Z
7000030330062,北浦財産区,キタウラザイサンク,33101,岡山県岡山市北区大供１丁目１－１,2018-04-08T15:00:00.000Z
1000030330118,宿財産区,シュクザイサンク,33101,岡山県岡山市北区大供１丁目１－１,2018-04-08T15:00:00.000Z
4000030330288,米倉財産区,ヨネグラザイサンク,33101,岡山県岡山市北区大供１丁目１－１,2018-04-08T15:00:00.000Z
4000030330197,西片岡財産区,ニシカタオカザイサンク,33101,岡山県岡山市北区大供１丁目１－１,2018-04-08T15:00:00.000Z
1000030330282,横井上・田益財産区,ヨコイカミタマスザイサンク,33101,岡山県岡山市北区大供１丁目１－１,2018-04-08T15:00:00.000Z
4000030330107,下足守財産区,シモアシモリザイサンク,33101,岡山県岡山市北区大供１丁目１－１,2018-04-08T15:00:00.000Z
1000030330200,西幸西財産区,ニシコウザイザイサンク,33101,岡山県岡山市北区大供１丁目１－１,2018-04-08T15:00:00.000Z
4000030330024,巌井財産区（巌井村外８ヶ町）,イワイザイサンクイワイソンホカハチカチョウ,33101,岡山県岡山市北区大供１丁目１－１,2018-04-08T15:00:00.000Z
7000030330112,下中野西市財産区,シモナカノニシイチザイサンク,33101,岡山県岡山市北区大供１丁目１－１,2018-04-08T15:00:00.000Z
2000030330083,苔山財産区,コケヤマザイサンク,33101,岡山県岡山市北区大供１丁目１－１,2018-04-08T15:00:00.000Z
2000030330001,青江財産区,アオエザイサンク,33101,岡山県岡山市北区大供１丁目１－１,2018-04-08T15:00:00.000Z
7000030330153,玉柏財産区（宮本組）,タマガシザイサンクミヤモトグミ,33101,岡山県岡山市北区大供１丁目１－１,2018-04-08T15:00:00.000Z
2000030330182,中川町財産区,ナカガワチョウザイサンク,33101,岡山県岡山市北区大供１丁目１－１,2018-04-08T15:00:00.000Z
7000030330252,三手財産区,ミテザイサンク,33101,岡山県岡山市北区大供１丁目１－１,2018-04-08T15:00:00.000Z
2000030330224,東幸崎財産区,ヒガシコウザキザイサンク,33101,岡山県岡山市北区大供１丁目１－１,2018-04-08T15:00:00.000Z
3000030330231,日近財産区,ヒヂカイザイサンク,33101,岡山県岡山市北区大供１丁目１－１,2018-04-08T15:00:00.000Z
3000030330149,玉柏財産区（河本組）,タマガシザイサンクコウモトグミ,33101,岡山県岡山市北区大供１丁目１－１,2018-04-08T15:00:00.000Z
3000030330074,倉田財産区,クラタザイサンク,33101,岡山県岡山市北区大供１丁目１－１,2018-04-08T15:00:00.000Z
1000030330134,大安寺財産区（本村正野田組総持）,ダイアンジザイサンクホンムラショウノダグミソウモチ,33101,岡山県岡山市北区大供１丁目１－１,2018-04-08T15:00:00.000Z
4000030330214,芳賀財産区,ハガザイサンク,33101,岡山県岡山市北区大供１丁目１－１,2018-04-08T15:00:00.000Z
4000030330123,新庄上財産区,シンジョウカミザイサンク,33101,岡山県岡山市北区大供１丁目１－１,2018-04-08T15:00:00.000Z
1000030330217,畑鮎財産区（大字金山寺）,ハタアユザイサンクオオアザカナヤマジ,33101,岡山県岡山市北区大供１丁目１－１,2018-04-08T15:00:00.000Z
4000030330040,金岡財産区,カナオカザイサンク,33101,岡山県岡山市北区大供１丁目１－１,2018-04-08T15:00:00.000Z
2000030330026,浦間財産区,ウラマザイサンク,33101,岡山県岡山市北区大供１丁目１－１,2018-04-08T15:00:00.000Z
7000030330178,富田町財産区,トンダチョウザイサンク,33101,岡山県岡山市北区大供１丁目１－１,2018-04-08T15:00:00.000Z
3000030330289,米田財産区,ヨネダザイサンク,33101,岡山県岡山市北区大供１丁目１－１,2018-04-08T15:00:00.000Z
3000030330280,山上財産区,ヤマノウエザイサンク,33101,岡山県岡山市北区大供１丁目１－１,2018-04-08T15:00:00.000Z
2000030330109,下財産区,シモザイサンク,33101,岡山県岡山市北区大供１丁目１－１,2018-04-08T15:00:00.000Z
7000030330269,牟佐財産区（大久保）,ムサザイサンクオオクボ,33101,岡山県岡山市北区大供１丁目１－１,2018-04-08T15:00:00.000Z
2000030330240,藤井財産区,フジイザイサンク,33101,岡山県岡山市北区大供１丁目１－１,2018-04-08T15:00:00.000Z
3000030330256,南古都財産区,ミナミコズザイサンク,33101,岡山県岡山市北区大供１丁目１－１,2018-04-08T15:00:00.000Z
1000030330068,君津外３ヶ村財産区（君津、升田、政津、豊田）,キミツホカサンカソンザイサンクキミツマスダマサツトヨタ,33101,岡山県岡山市北区大供１丁目１－１,2018-04-08T15:00:00.000Z
3000030330165,角山村財産区,ツノヤマムラザイサンク,33101,岡山県岡山市北区大供１丁目１－１,2018-04-08T15:00:00.000Z
3000030330090,西大寺一宮財産区,サイダイジイチノミヤザイサンク,33101,岡山県岡山市北区大供１丁目１－１,2018-04-08T15:00:00.000Z
3000030330009,一宮財産区,イチノミヤザイサンク,33101,岡山県岡山市北区大供１丁目１－１,2018-04-08T15:00:00.000Z
7000030330013,今岡財産区,イマオカザイサンク,33101,岡山県岡山市北区大供１丁目１－１,2018-04-08T15:00:00.000Z
4000030330230,東山内財産区,ヒガシヤマノウチザイサンク,33101,岡山県岡山市北区大供１丁目１－１,2018-04-08T15:00:00.000Z
4000030330148,玉柏財産区（玉柏村総持）,タマガシザイサンクタマガシソンソウモチ,33101,岡山県岡山市北区大供１丁目１－１,2018-04-08T15:00:00.000Z
1000030330233,日畑東組財産区,ヒバタヒガシグミザイサンク,33101,岡山県岡山市北区大供１丁目１－１,2018-04-08T15:00:00.000Z
4000030330057,神崎町財産区,カンザキチョウザイサンク,33101,岡山県岡山市北区大供１丁目１－１,2018-04-08T15:00:00.000Z
1000030330159,津島財産区（本村総持）,ツシマザイサンクホンムラソウモチ,33101,岡山県岡山市北区大供１丁目１－１,2018-04-08T15:00:00.000Z
2000030330042,金山寺財産区,カナヤマジザイサンク,33101,岡山県岡山市北区大供１丁目１－１,2018-04-08T15:00:00.000Z
7000030330194,楢原財産区,ナラバラザイサンク,33101,岡山県岡山市北区大供１丁目１－１,2018-04-08T15:00:00.000Z
1000030330043,上足守財産区,カミアシモリザイサンク,33101,岡山県岡山市北区大供１丁目１－１,2018-04-08T15:00:00.000Z
2000030330125,新保財産区,シンボウザイサンク,33101,岡山県岡山市北区大供１丁目１－１,2018-04-08T15:00:00.000Z
2000030330257,南水門町財産区,ミナミスイモンチョウザイサンク,33101,岡山県岡山市北区大供１丁目１－１,2018-04-08T15:00:00.000Z
7000030330087,小山財産区,コヤマザイサンク,33101,岡山県岡山市北区大供１丁目１－１,2018-04-08T15:00:00.000Z
3000030330181,中尾財産区,ナカオザイサンク,33101,岡山県岡山市北区大供１丁目１－１,2018-04-08T15:00:00.000Z
3000030330108,下阿知財産区,シモアチザイサンク,33101,岡山県岡山市北区大供１丁目１－１,2018-04-08T15:00:00.000Z
1000030330142,竹田財産区,タケダザイサンク,33101,岡山県岡山市北区大供１丁目１－１,2018-04-08T15:00:00.000Z
3000030330025,岩田町財産区,イワタチョウザイサンク,33101,岡山県岡山市北区大供１丁目１－１,2018-04-08T15:00:00.000Z
7000030330129,洲崎財産区,スザキザイサンク,33101,岡山県岡山市北区大供１丁目１－１,2018-04-08T15:00:00.000Z
7000030330038,掛畑財産区,カケハタザイサンク,33101,岡山県岡山市北区大供１丁目１－１,2018-04-08T15:00:00.000Z
1000030330084,古都宿財産区,コズシュクザイサンク,33101,岡山県岡山市北区大供１丁目１－１,2018-04-08T15:00:00.000Z
4000030330247,円山財産区（円山村総持）,マルヤマザイサンクマルヤマソンソウモチ,33101,岡山県岡山市北区大供１丁目１－１,2018-04-08T15:00:00.000Z
7000030330079,河本町財産区,コウモトチョウザイサンク,33101,岡山県岡山市北区大供１丁目１－１,2018-04-08T15:00:00.000Z
4000030330164,津寺財産区,ツデラザイサンク,33101,岡山県岡山市北区大供１丁目１－１,2018-04-08T15:00:00.000Z
1000030330258,三野財産区,ミノザイサンク,33101,岡山県岡山市北区大供１丁目１－１,2018-04-08T15:00:00.000Z
4000030330073,久米財産区,クメザイサンク,33101,岡山県岡山市北区大供１丁目１－１,2018-04-08T15:00:00.000Z
1000030330175,富吉財産区（上風林）,トミヨシザイサンクカミカザハヤシ,33101,岡山県岡山市北区大供１丁目１－１,2018-04-08T15:00:00.000Z
2000030330059,神崎町外３財産区（乙子、東幸西、西幸西）,カンザキチョウホカサンザイサンクオトゴヒガシコウザイニシコウザイ,33101,岡山県岡山市北区大供１丁目１－１,2018-04-08T15:00:00.000Z
7000030330211,納所財産区,ノウソザイサンク,33101,岡山県岡山市北区大供１丁目１－１,2018-04-08T15:00:00.000Z
1000030330019,巌井財産区（西崎組総持）,イワイザイサンクニシザキグミソウモチ,33101,岡山県岡山市北区大供１丁目１－１,2018-04-08T15:00:00.000Z
2000030330141,高屋財産区,タカヤザイサンク,33101,岡山県岡山市北区大供１丁目１－１,2018-04-08T15:00:00.000Z
2000030330273,門前財産区,モンゼンザイサンク,33101,岡山県岡山市北区大供１丁目１－１,2018-04-08T15:00:00.000Z
3000030330207,西山内財産区,ニシヤマノウチザイサンク,33101,岡山県岡山市北区大供１丁目１－１,2018-04-08T15:00:00.000Z
3000030330124,新庄下財産区,シンジョウシモザイサンク,33101,岡山県岡山市北区大供１丁目１－１,2018-04-08T15:00:00.000Z
