date_of_order,title,amount,government_departments,joint_signatures,corporate_number
2018-09-03T00:00:00+09:00,医療機関におけるＵＤＩ利活用推進事業に係るモデル病院調査一式,7776000,厚生労働省,,9011105006212
2019-04-01T00:00:00+09:00,平成３１年度革新的なエネルギー技術の国際共同研究開発事業（過酷温度環境作動リチウムイオン二次電池の開発）,37670000,経済産業省,"国立研究開発法人産業技術総合研究所",9012405001241
2019-04-01T00:00:00+09:00,平成３１年度中小商工業等統計調査事務地方公共団体委託費,259023000,経済産業省,"福井県,長野県,島根県,徳島県,佐賀県,北海道,新潟県,三重県,鹿児島県,埼玉県,石川県,和歌山県,東京都,秋田県,茨城県,滋賀県,高知県,福岡県,長崎県,宮崎県,岩手県,宮城県,栃木県,群馬県,千葉県,岐阜県,兵庫県,愛媛県,大分県,青森県,山形県,静岡県,大阪府,広島県,沖縄県,福島県,山梨県,岡山県,神奈川県,富山県,愛知県,京都府,鳥取県,山口県,香川県,熊本県",1000020290009
2019-06-13T00:00:00+09:00,令和元年度起業家教育事業,39981992,中小企業庁,,1010001013874
2019-10-08T00:00:00+09:00,令和元年度中小企業実態調査事業（一般競争入札における一者応札に関する調査及び国の調達におけるベンチャー企業の参入拡大に関する調査）,6499254,経済産業省,,1010001143390
2019-04-02T00:00:00+09:00,平成３０年度補正国際博覧会政府開催準備事業（２０２５年国際博覧会のテーマ具体化に係る調査等）,61083000,経済産業省,,1010001143390
2019-08-08T00:00:00+09:00,令和元年度産業財産権制度問題調査研究「コンピュータソフトウェア関連発明等の機能的特許クレームの保護のあり方に関する調査研究」　一式,16478000,特許庁,,1010005019637
2019-12-25T00:00:00+09:00,令和元年度地球温暖化問題等対策調査（容器包装リサイクル推進調査＜再商品化義務履行状況及び使用合理化状況調査＞）,4070000,経済産業省,,1010401016683
2019-08-20T00:00:00+09:00,ＴＩＣＡＤ７における作業室の借り上げ,2210371,経済産業省,,1020001016273
2020-03-06T00:00:00+09:00,知財総合支援窓口運営業務（富山県）一式,48471287,工業所有権情報・研修館,,1230005007768
2019-08-09T00:00:00+09:00,特許庁総合庁舎第一期改修工事後の移転計画に係る支援業務　一式,90200000,特許庁,,2010001008683
2019-04-01T00:00:00+09:00,平成３１年度地球温暖化対策における国際機関等連携事業委託費（ＴＣＦＤ・開示に関する国際会合の開催）,91526941,経済産業省,,2010001033161
2019-07-31T00:00:00+09:00,経済産業省基盤情報システムサービス（内部サイトのＴＬＳ化等セキュリティ強化）,57432711,経済産業省,"日本電気株式会社",2010001033475
2019-11-28T00:00:00+09:00,令和元年度中心市街地活性化支援人材育成事業（商店街におけるＰＤＣＡサイクル活用の促進に関する調査）,2343000,中小企業庁,,2010001155749
2019-04-01T00:00:00+09:00,平成３１年度国内石油天然ガスに係る地質調査・メタンハイドレートの研究開発等事業（メタンハイドレートの研究開発）,6952603000,資源エネルギー庁,"国立研究開発法人産業技術総合研究所,独立行政法人石油天然ガス・金属鉱物資源機構",2010001163280
2020-03-18T00:00:00+09:00,ＰＭＳ会計系システムの運用保守業務,3627800,国立研究開発法人新エネルギー・産業技術総合開発機構,,2011101056358
2020-03-06T00:00:00+09:00,知財総合支援窓口運営業務（栃木県）一式,82357533,工業所有権情報・研修館,,2060005007586
2020-03-06T00:00:00+09:00,知財総合支援窓口運営業務（北海道）一式,115020208,工業所有権情報・研修館,,2430005008687
2019-12-25T00:00:00+09:00,令和元年度戦略的基盤技術高度化・連携支援事業（中小企業のＡＩ活用促進に関する調査事業）,5500000,経済産業省,,2700150006311
2019-06-20T00:00:00+09:00,令和元年度燃料安定供給対策に関する調査事業（ＬＮＧ市場の柔軟性向上に向けた課題及び対応策に関する調査等）,29728538,資源エネルギー庁,,3010005018926
2019-09-05T00:00:00+09:00,令和元年度エネルギー需給構造高度化対策に関する調査等委託事業（エネルギーレジリエンスに関する調査・分析）,16990216,資源エネルギー庁,,3010005018926
2019-04-03T00:00:00+09:00,平成３１年度原子力発電施設広聴・広報等事業（放射性廃棄物に関する理解促進・支援事業）,68586131,資源エネルギー庁,,3010005018942
2019-11-14T00:00:00+09:00,令和元年度安全保障貿易管理対策事業（我が国における重要鉱物の流通管理高度化調査）,8980125,経済産業省,,3010401011971
2019-11-19T00:00:00+09:00,令和元年度皮革産業振興対策調査等（海外主要国における皮革関連産業のサステナビリティ活動等の動向・対応調査）,6875000,経済産業省,,3010401011971
2019-04-01T00:00:00+09:00,平成３１年度経済産業省デジタルプラットフォーム構築事業（地域経済分析システムのシステム更新・運用・保守業務）,368500000,経済産業省,,3010401011971
2019-09-05T00:00:00+09:00,令和元年度地球温暖化・資源循環対策等に資する調査委託費（資源効率性に関する調査等事業）,14997453,経済産業省,,3010401011971
2019-04-01T00:00:00+09:00,複写機の保守及び消耗品の供給（富士ゼロックス（株）　２８ＦＹ入札分　カラー）,0,経済産業省,,3010401026805
2019-07-02T00:00:00+09:00,令和元年度産業財産権制度各国比較調査研究等事業「米欧中韓における特許の有効性判断、権利化後のクレームの訂正についての制度、運用実態及び統計分析に関する調査研究」　　一式,24498313,特許庁,,3010405010615
2019-04-01T00:00:00+09:00,商標審査前サーチレポート（不明確な指定商品・役務に係る調査）作成事業　約２８，８９４件（予定）,116529502,特許庁,,3010605002131
2020-03-06T00:00:00+09:00,知財総合支援窓口運営業務（岡山県）一式,78425599,工業所有権情報・研修館,,3260005009000
2019-04-01T00:00:00+09:00,平成３１年度中小商工業等統計調査事務地方公共団体委託費,259023000,経済産業省,"福井県,長野県,島根県,徳島県,佐賀県,北海道,新潟県,三重県,鹿児島県,埼玉県,石川県,和歌山県,東京都,秋田県,茨城県,滋賀県,奈良県,高知県,福岡県,宮崎県,岩手県,宮城県,栃木県,群馬県,千葉県,岐阜県,兵庫県,愛媛県,大分県,青森県,山形県,静岡県,大阪府,広島県,沖縄県,福島県,山梨県,岡山県,神奈川県,富山県,愛知県,京都府,鳥取県,山口県,香川県,熊本県",4000020420000
2019-04-01T00:00:00+09:00,平成３１年度中小商工業等統計調査事務地方公共団体委託費,259023000,経済産業省,"福井県,長野県,島根県,徳島県,佐賀県,北海道,新潟県,三重県,鹿児島県,埼玉県,石川県,和歌山県,東京都,秋田県,茨城県,滋賀県,奈良県,高知県,福岡県,長崎県,岩手県,宮城県,栃木県,群馬県,千葉県,岐阜県,兵庫県,愛媛県,大分県,青森県,山形県,静岡県,大阪府,広島県,沖縄県,福島県,山梨県,岡山県,神奈川県,富山県,愛知県,京都府,鳥取県,山口県,香川県,熊本県",4000020450006
2019-11-22T00:00:00+09:00,令和元年度サイバー・フィジカル・セキュリティ対策促進事業（ビルシステムのサイバーセキュリティ高度化に向けた調査）,9900000,経済産業省,,4010001054032
2019-04-08T00:00:00+09:00,高速プリンタ用Ａ４カット紙の購入　２６，７６０，０００枚（予定）,16773240,特許庁,,4010001104613
2020-02-28T00:00:00+09:00,複写用紙（Ａ４判再生紙）の購入２，４９５，０００枚（予定）,1734524,工業所有権情報・研修館,,4010001104613
2019-11-27T00:00:00+09:00,令和元年度化学物質安全対策（第一種特定化学物質含有製品等の安全性に関する調査）,5390000,経済産業省,,4010005015204
2019-04-01T00:00:00+09:00,平成３１年度中小企業等経営強化法に基づく経営力向上計画申請プラットフォーム構築・調査事業,80280644,中小企業庁,,4010401048922
2019-12-23T00:00:00+09:00,ＪＩＳマークの外国商標登録の区分及びその登録費用に関する調査業務,2325136,経済産業省,,4010705001684
2019-04-01T00:00:00+09:00,特許庁庁舎中水処理設備の汚泥収集・運搬及び処分業務　一式,1927120,特許庁,,4011701002635
2019-04-01T00:00:00+09:00,平成３１年度化学物質安全対策（化学物質管理分野におけるアジア協力に関する調査）,22275000,経済産業省,,4013301013616
2020-03-06T00:00:00+09:00,知財総合支援窓口運営業務（埼玉県）一式,69418962,工業所有権情報・研修館,,4030005000609
2019-09-24T00:00:00+09:00,令和元年度資源エネルギー庁ホームページのウェブアクセシビリティ方針の試験評価業務,946000,資源エネルギー庁,,4140001010682
2020-03-06T00:00:00+09:00,知財総合支援窓口運営業務（長崎県）一式,54074389,工業所有権情報・研修館,,4310005005975
2019-04-01T00:00:00+09:00,平成３１年度中小商工業等統計調査事務地方公共団体委託費,259023000,経済産業省,"福井県,長野県,島根県,徳島県,佐賀県,北海道,新潟県,三重県,鹿児島県,埼玉県,石川県,和歌山県,東京都,秋田県,茨城県,滋賀県,奈良県,福岡県,長崎県,宮崎県,岩手県,宮城県,栃木県,群馬県,千葉県,岐阜県,兵庫県,愛媛県,大分県,青森県,山形県,静岡県,大阪府,広島県,沖縄県,福島県,山梨県,岡山県,神奈川県,富山県,愛知県,京都府,鳥取県,山口県,香川県,熊本県",5000020390003
2019-04-01T00:00:00+09:00,経済産業局業務支援システム用機器撤去作業,4536000,経済産業省,,5010001006767
2019-04-01T00:00:00+09:00,平成３１年度通訳業務,108000,経済産業省,,5010001031682
2019-05-31T00:00:00+09:00,「特許行政年次報告書２０１９年版」（本編及び統計資料編）の作成　一式,5285304,特許庁,,5010001067883
2019-11-20T00:00:00+09:00,令和元年度中小企業実態調査事業（中小企業の基準や成長等に関する調査研究）,12967073,中小企業庁,,5010001134287
2019-10-31T00:00:00+09:00,令和元年度産業保安等技術基準策定研究開発等（ガス機器の海外規格との整合化検討のための安全性能確認事業）,24878238,経済産業省,,5010405009408
2019-11-06T00:00:00+09:00,令和元年度産業経済研究委託事業（経済産業政策・第四次産業革命関係調査事業費（組織運営・経営戦略動向に関する調査事業））,9900000,経済産業省,,5011101026184
2020-03-06T00:00:00+09:00,知財総合支援窓口運営業務（三重県）一式,66490105,工業所有権情報・研修館,,5180001115849
2019-04-01T00:00:00+09:00,平成３１年度中小商工業等統計調査事務地方公共団体委託費,259023000,経済産業省,"福井県,長野県,島根県,徳島県,佐賀県,北海道,新潟県,三重県,鹿児島県,埼玉県,石川県,和歌山県,東京都,秋田県,茨城県,滋賀県,奈良県,高知県,長崎県,宮崎県,岩手県,宮城県,栃木県,群馬県,千葉県,岐阜県,兵庫県,愛媛県,大分県,青森県,山形県,静岡県,大阪府,広島県,沖縄県,福島県,山梨県,岡山県,神奈川県,富山県,愛知県,京都府,鳥取県,山口県,香川県,熊本県",6000020400009
2019-12-27T00:00:00+09:00,令和元年度サイバー・フィジカル・セキュリティ対策促進事業（フィジカル空間とサイバー空間のつながりの信頼性確保のためのセキュリティ対策に関する調査）,36300000,経済産業省,,6010001030403
2019-10-03T00:00:00+09:00,令和元年度産業保安等技術基準策定研究開発等事業（グローバルサプライチェーンを背景とした輸入製品事故の減少に資する海外制度に係る動向調査）,19739500,経済産業省,,6010001030403
2019-10-21T00:00:00+09:00,令和元年度地球温暖化・資源循環対策等に資する調査委託費（プラスチック等資源循環推進調査）,13200000,経済産業省,,6010001030403
2019-04-16T00:00:00+09:00,平成３１年度我が国におけるデータ駆動型社会に係る基盤整備（家電リサイクル制度等の高度化に向けた調査）,11000000,経済産業省,,6010001030403
2019-04-04T00:00:00+09:00,平成３１年度エネルギー需給構造高度化対策に関する調査等事業（分散型エネルギーリソースを活用したアグリゲーションビジネスに関する国内制度構築等に関する調査）,33000000,資源エネルギー庁,,6010001030403
2019-07-26T00:00:00+09:00,令和元年度原子力の利用状況等に関する調査（海外における原子力政策等動向調査）,34100000,資源エネルギー庁,,6010001030403
2019-04-01T00:00:00+09:00,資源エネルギー庁が開催する会議等における議事録作成作業（速記・反訳）,17820,資源エネルギー庁,,6011101004370
2020-03-02T00:00:00+09:00,新製品カタログの収集業務１５０００件,8646000,工業所有権情報・研修館,,6020001110501
2020-02-13T00:00:00+09:00,ＯＣＲ装置の賃貸借及び保守業務,15950000,情報処理推進機構,"東京センチュリー株式会社",6220001017593
2019-04-01T00:00:00+09:00,平成３１年度中小商工業等統計調査事務地方公共団体委託費,259023000,経済産業省,"福井県,長野県,島根県,徳島県,佐賀県,北海道,新潟県,三重県,鹿児島県,埼玉県,石川県,和歌山県,東京都,秋田県,茨城県,奈良県,高知県,福岡県,長崎県,宮崎県,岩手県,宮城県,栃木県,群馬県,千葉県,岐阜県,兵庫県,愛媛県,大分県,青森県,山形県,静岡県,大阪府,広島県,沖縄県,福島県,山梨県,岡山県,神奈川県,富山県,愛知県,京都府,鳥取県,山口県,香川県,熊本県",7000020250007
2019-04-01T00:00:00+09:00,マルチメディア型情報サービス「日経テレコン２１」の提供,46912084,経済産業省,"株式会社日本経済新聞社",7010001025724
2019-04-01T00:00:00+09:00,新聞・雑誌記事情報等データベースを有するインターネットサイトの利用　一式,20676188,特許庁,,7010001025724
2019-05-10T00:00:00+09:00,令和元年度エネルギー需給構造高度化対策に関する調査等事業（福島県における再生可能エネルギー導入促進支援のための調査）,14300000,資源エネルギー庁,,7010001042703
2019-10-17T00:00:00+09:00,令和元年度経済産業省デジタルプラットフォーム構築事業（法人共通認証基盤の機能追加に関する実証・調査事業）,49759279,経済産業省,,7010001064648
2019-04-15T00:00:00+09:00,平成３０年度補正経済産業省デジタルプラットフォーム構築事業（補助金申請システムの構築等事業）,304797064,経済産業省,,7010001064648
2020-02-17T00:00:00+09:00,産業サイバーセキュリティセンター拠点ネットワーク等の運用等業務,380160000,情報処理推進機構,,7010001064648
2019-04-24T00:00:00+09:00,平成３１年度国内における温室効果ガス排出削減・吸収量認証制度の実施事業（グリーンエネルギーＣＯ２削減相当量認証制度運営事業）,12344865,資源エネルギー庁,,7010001088960
2020-03-26T00:00:00+09:00,知財総合支援窓口移転に係る新聞広告の掲載　一式,8042210,工業所有権情報・研修館,,7010001195294
2019-04-01T00:00:00+09:00,平成３１年度国内石油天然ガスに係る地質調査・メタンハイドレートの研究開発等事業（メタンハイドレートの研究開発）,6952603000,資源エネルギー庁,"日本メタンハイドレート調査株式会社,独立行政法人石油天然ガス・金属鉱物資源機構",7010005005425
2019-11-14T00:00:00+09:00,令和元年度戦略的基盤技術高度化支援事業（地域におけるものづくり中小企業デジタル化の面的展開に関する調査事業）,66000000,中小企業庁,,7010401001556
2019-12-26T00:00:00+09:00,令和元年度地球温暖化・資源循環対策等に資する調査委託費（資源循環の促進のためのプラスチック使用合理化のための制度普及事業）,6455900,経済産業省,,7010401009665
2019-04-01T00:00:00+09:00,特許証等の作成　２１７，４９９件（予定）,21573726,特許庁,,7010401009665
2019-04-01T00:00:00+09:00,平成３１年度追録（企業再編シリーズ　企業再編の税務　外２２件）の売買,1628756,経済産業省,,7010401017486
2019-08-14T00:00:00+09:00,２０１９年度模倣被害実態調査　　一式,10964800,特許庁,,7010401018377
2019-04-01T00:00:00+09:00,年金領収書等仕分け・発送業務　１，０５９，０００件（予定）,2424051,特許庁,,7010401020886
2019-04-01T00:00:00+09:00,ＮＮＡホームページ及びＮＮＡ日刊版Ｅ－ＭＡＩＬの利用,3118272,経済産業省,,7010401021950
2019-04-10T00:00:00+09:00,人事異動及びレイアウト変更に伴うＩＰ電話機移設等工事　一式,11988474,特許庁,,7010401022916
2020-06-18T00:00:00+09:00,規制の精緻化に向けたデジタル技術の開発マネー・ロンダリング対策に係るシステム開発,323336200,国立研究開発法人新エネルギー・産業技術総合開発機構,,7010401022916
2020-06-18T00:00:00+09:00,高効率・高速処理を可能とするＡＩチップ・次世代コンピューティングの技術開発超伝導体・半導体技術を融合した集積量子計算システムの開発,83397600,国立研究開発法人新エネルギー・産業技術総合開発機構,,7010401022916
2019-04-01T00:00:00+09:00,文献解析及びデータ作成のための公報審査資料の調達　４８２，０００頁（予定）,1613736,特許庁,,7010501016231
2019-04-01T00:00:00+09:00,タクシー供給に関する請負契約,0,経済産業省,,7013305000491
2019-04-01T00:00:00+09:00,平成３１年度中小商工業等統計調査事務地方公共団体委託費,259023000,経済産業省,"福井県,長野県,島根県,徳島県,佐賀県,北海道,新潟県,三重県,鹿児島県,埼玉県,石川県,和歌山県,秋田県,茨城県,滋賀県,奈良県,高知県,福岡県,長崎県,宮崎県,岩手県,宮城県,栃木県,群馬県,千葉県,岐阜県,兵庫県,愛媛県,大分県,青森県,山形県,静岡県,大阪府,広島県,沖縄県,福島県,山梨県,岡山県,神奈川県,富山県,愛知県,京都府,鳥取県,山口県,香川県,熊本県",8000020130001
2019-04-01T00:00:00+09:00,平成３１年度新エネルギー等の導入促進のための広報等事業（再生可能エネルギーに係るポータルサイト運営事業）,13773948,資源エネルギー庁,,8010001014395
2020-02-26T00:00:00+09:00,ＩＰＡ広報誌『ＩＰＡＮＥＷＳ』Ｖｏｌ．４６－５１の印刷及び発送等業務,5353326,情報処理推進機構,,8010001090081
2019-04-01T00:00:00+09:00,技術的整合性検証等に係る労働者派遣　２名,45906784,特許庁,,8010001098182
2019-07-29T00:00:00+09:00,令和元年度燃料安定供給対策に関する調査事業（我が国の上流開発産業の中長期的な成長に向けた企業と政府の在り方等に関する調査）,10340000,資源エネルギー庁,,8010005011876
2019-05-15T00:00:00+09:00,令和元年度特許出願技術動向調査－ＡＩを用いた画像処理－　一式,55440000,特許庁,,8010401050783
2019-04-01T00:00:00+09:00,ＮＨＫ放送受信料,2766216,経済産業省,,8011005000968
2019-10-07T00:00:00+09:00,令和元年度化学物質安全対策（化学兵器の禁止及び特定物質の規制等に関する法律の届出電子化等に伴うシステム構築に関する検討調査）,12878030,経済産業省,,9010001027685
2019-08-02T00:00:00+09:00,令和元年度中小企業実態調査事業（エンジェル税制活用による地方ベンチャー企業活性化に係る調査委託事業）,13750000,中小企業庁,,9010001027685
2020-06-18T00:00:00+09:00,戦略策定調査事業ブルーカーボン（海洋生態系によるＣＯ２固定化）の追求に関する技術戦略策定調査,9997900,国立研究開発法人新エネルギー・産業技術総合開発機構,,9010001027685
2019-08-13T00:00:00+09:00,令和元年度内外一体の経済成長戦略構築にかかる国際経済調査事業（横断的な技術情報を活用したイノベーター分析事業）,9991806,経済産業省,,9010001119219
2019-10-08T00:00:00+09:00,令和元年度経済産業省デジタルプラットフォーム構築事業（ＩＭＩ情報共有基盤推進事業）,30795930,経済産業省,,9010001130423
2019-11-12T00:00:00+09:00,令和元年度内外一体の経済成長戦略構築にかかる国際経済調査事業（【中国】中国における事業環境に関する分析）,7571470,経済産業省,,9010005016775
2019-04-01T00:00:00+09:00,アジャイル型開発手法によるシステム開発・運用保守に係る労働者派遣　４名,40041150,特許庁,,9010401052894
2019-04-01T00:00:00+09:00,平成３１年度高圧ガス製造保安責任者免状交付事業,5560322,経済産業省,,9010405002433
2019-11-21T00:00:00+09:00,令和元年度内外一体の経済成長戦略構築にかかる国際経済調査事業（宇宙状況把握データプラットフォーム形成に向けた各国動向調査）,8527695,経済産業省,,9010601047471
2019-04-01T00:00:00+09:00,商標事件管理業務等に係る労働者派遣　１名,3344953,特許庁,,9011101059288
2020-03-18T00:00:00+09:00,令和２年度調査業務実施者育成研修面接評価第一、第二　運営関連業務　一式,4504808,工業所有権情報・研修館,,9011101059288
2018-09-03T00:00:00+09:00,医療機関におけるＵＤＩ利活用推進事業に係るモデル病院調査一式,7776000,厚生労働省,,9011105006212
2019-12-25T00:00:00+09:00,情報処理安全確保支援士講習運営業務（２０２０年度講習運営）,690257920,情報処理推進機構,,1010001034730
2020-04-01T00:00:00+09:00,令和２年度大学等の革新的な研究成果の権利取得・活用支援事業　一式,189597980,特許庁,,1010001143390
2019-09-12T00:00:00+09:00,令和元年度サイバー・フィジカル・セキュリティ対策促進事業（ソフトウェアを安全に利活用するための基盤構築に向けた調査）,12650000,経済産業省,,1010001143390
2019-09-27T00:00:00+09:00,令和元年度産業経済研究委託事業（我が国におけるＦｉｎＴｅｃｈ普及に向けた基盤整備に関する調査検討）,17406092,経済産業省,,1010001143390
2018-11-28T00:00:00+09:00,平成３０年度産業経済研究委託事業（経済産業政策・第四次産業革命関係調査事業費）（事業再編の実態等に関する調査）,27000000,経済産業省,,1010005005918
2020-04-28T00:00:00+09:00,令和２年度産業財産権制度問題調査研究「ＡＩ・ＩｏＴ技術の時代にふさわしい特許制度の在り方に関する調査研究」　一式,22499950,特許庁,,1010005019637
2019-11-01T00:00:00+09:00,経済産業省の危機管理広報に係る役務請負,1045000,経済産業省,,1010401085687
2019-11-14T00:00:00+09:00,労働者派遣業務（２０１９年１２月契約開始分【高度事務派遣】）,11380875,情報処理推進機構,,1010401090191
2019-04-01T00:00:00+09:00,平成３１年度安全保障貿易管理情報ＤＢの運用保守業務,9571944,経済産業省,,1010401092989
2019-07-08T00:00:00+09:00,令和元年度産業技術調査事業（海外主要国における研究開発税制等に関する実態調査）,10946100,経済産業省,,1010405003760
2020-07-09T00:00:00+09:00,特許庁庁舎間及び庁舎内の移転に伴う運搬業務　一式,36850000,特許庁,,1010601022399
2020-01-27T00:00:00+09:00,経済産業省地域別鉱工業生産指数作成システムの改修等業務役務請負,11880000,経済産業省,,1010901026918
2019-04-01T00:00:00+09:00,文書等溶解作業　役務請負,8,経済産業省,,1011501008422
2020-08-03T00:00:00+09:00,カーボンリサイクル実現を加速するバイオ由来製品生産技術の開発カーボンリサイクル実現を加速するバイオ由来製品生産技術の開発データベース空間からの新規酵素リソースの創出,3999600,国立研究開発法人新エネルギー・産業技術総合開発機構,,1030005007111
2020-08-24T00:00:00+09:00,ＣＣＳ研究開発・実証関連事業ＣＯ２分離回収技術の研究開発先進的二酸化炭素固体吸収材の石炭燃焼排ガス適用性研究,3559856300,国立研究開発法人新エネルギー・産業技術総合開発機構,,1140001005719
2019-10-31T00:00:00+09:00,令和元年度地球温暖化問題等対策調査（途上国における適応分野の我が国企業の貢献可視化事業）,17006369,経済産業省,,2010001016851
