date_of_order,title,amount,government_departments,joint_signatures,corporate_number
2019-04-01T00:00:00+09:00,平成３１年度商業動態統計調査に係るデータ作成作業,1634934,経済産業省,,4010401025211
2018-12-27T00:00:00+09:00,平成３０年度電気施設等の保安規制の合理化検討に係る調査（電気工事業者情報の管理等に関する調査・検討）,32400000,経済産業省,,4010401058525
2019-11-25T00:00:00+09:00,水素社会構築技術開発事業総合調査研究地産地消型水素製造・利活用ポテンシャル調査（オフサイト再エネ電力の自産自消によるＰ２Ｇの事業化可能性調査）,21450000,国立研究開発法人新エネルギー・産業技術総合開発機構,,4010701022825
2020-05-12T00:00:00+09:00,令和元年度補正認知症共生等を通じた予防・健康づくり基盤整備事業,30350000,経済産業省,,4010701026082
2018-12-26T00:00:00+09:00,平成３０年度商取引・サービス環境の適正化に係る事業（日本版ブロードウェイ構想に関する基盤調査）,9939730,経済産業省,,4010701026082
2018-12-28T00:00:00+09:00,平成３０年度商取引・サービス環境の適正化に関する事業（生涯現役社会の実現に向けた健康・医療産業の競争力強化に関する調査事業）,13190462,経済産業省,,4010701026082
2019-11-13T00:00:00+09:00,アジア省エネルギー型資源循環制度導入実証事業廃製品由来の二次電池に関する資源循環性向上に向けた検討,19890200,国立研究開発法人新エネルギー・産業技術総合開発機構,,4010701026082
2018-12-27T00:00:00+09:00,平成３０年度発電所の環境影響評価審査に係る調査委託費（洋上風力発電所調査等手法の検討）,11124000,経済産業省,,4011105005400
2020-06-18T00:00:00+09:00,ｉＰａｄ外２件の購入,12431298,経済産業省,,4040001006757
2020-07-31T00:00:00+09:00,カーボンリサイクル実現を加速するバイオ由来製品生産技術の開発カーボンリサイクル実現を加速するバイオ由来製品生産技術の開発データベース空間からの新規酵素リソースの創出,2420000,国立研究開発法人新エネルギー・産業技術総合開発機構,,4120001049021
2020-08-11T00:00:00+09:00,ＩｏＴ社会実現のための革新的センシング技術開発革新的センシング技術開発高真空ウェハレベルパッケージングを適用したＭＥＭＳセンサーの研究開発,74475500,国立研究開発法人新エネルギー・産業技術総合開発機構,,4290001021319
2020-05-07T00:00:00+09:00,令和２年度　特許出願技術動向調査―ＭａａＳ（Ｍｏｂｉｌｉｔｙ　ａｓ　ａ　Ｓｅｒｖｉｃｅ）　～　自動運転関連技術からの分析～―　一式,47300000,特許庁,,5010001022137
2020-07-27T00:00:00+09:00,経済産業省別館人荷用エレベーター設備改修工事,5139200,経済産業省,,5010001030412
2020-08-07T00:00:00+09:00,カーボンリサイクル実現を加速するバイオ由来製品生産技術の開発カーボンリサイクル実現を加速するバイオ由来製品生産技術の開発データ駆動型統合バイオ生産マネジメントシステム（Ｄａｔａ－ｄｒｉｖｅｎ　ｉＢＭＳ）の研究開発,30500000,国立研究開発法人新エネルギー・産業技術総合開発機構,,5010005007398
2020-04-01T00:00:00+09:00,審決公報に係る電子化業務　１，３６５件（予定）,22822800,特許庁,,5010005016746
2018-11-09T00:00:00+09:00,普通乗用自動車（次世代自動車：２，４０１ｃｃ～３，０００ｃｃ未満）の交換購入,14352580,経済産業省,,5010401035317
2018-11-05T00:00:00+09:00,外国出張における渡航支援業務,12219273,経済産業省,,5010401049977
2020-06-12T00:00:00+09:00,令和元年度大企業人材等の地方活躍推進事業（地域の中核企業による人材確保手法等の調査分析）,109903200,経済産業省,,5010405001703
2020-07-31T00:00:00+09:00,ＩｏＴ社会実現のための革新的センシング技術開発革新的センシング技術開発極限環境の液体管理をＩｏＴ化する革新的粘性センサの開発,15840000,国立研究開発法人新エネルギー・産業技術総合開発機構,,5020001023159
2019-10-17T00:00:00+09:00,戦略的イノベーション創造プログラム（ＳＩＰ）第２期／自動運転（システムとサービスの拡張）自動運転の高度化に則したＨＭⅠ及び安全教育方法に関する調査研究,98425000,国立研究開発法人新エネルギー・産業技術総合開発機構,,5050005005266
2019-10-17T00:00:00+09:00,戦略的イノベーション創造プログラム（ＳＩＰ）第２期／自動運転（システムとサービスの拡張）狭域・中域情報の収集・統合・配信に係る研究開発,76230000,国立研究開発法人新エネルギー・産業技術総合開発機構,,5120001158218
2020-06-24T00:00:00+09:00,令和２年度重要技術管理体制強化事業（中小企業等アウトリーチ事業）,98689338,経済産業省,,5120001180782
2020-05-11T00:00:00+09:00,令和２年度サイバー・フィジカル・セキュリティ対策促進事業（サプライチェーン・セキュリティ対策に関する調査）,23980000,経済産業省,,6010001030403
2018-12-28T00:00:00+09:00,平成３０年度高度な自動走行システムの社会実装に向けた研究開発・実証事業（自動運転が活用されうるコネクテッド技術に関する国内外動向調査）,23760000,経済産業省,,6010001030403
2020-04-01T00:00:00+09:00,令和２年度　通訳業務,105600,経済産業省,,6010001109206
2020-07-30T00:00:00+09:00,２０２０年度独立行政法人等に対するマネジメント監査の実施支援及び助言業務（その５）,6600000,情報処理推進機構,,6010001166313
2020-08-21T00:00:00+09:00,太陽光発電主力電源化推進技術開発動向調査等移動体用太陽電池の動向調査,45543300,国立研究開発法人新エネルギー・産業技術総合開発機構,,6010005012950
2020-05-12T00:00:00+09:00,令和２年度工場立地動向調査に係る集計・分析業務,1381050,経済産業省,,6010005018626
2020-08-11T00:00:00+09:00,太陽光発電主力電源化推進技術開発太陽光発電の長期安定電源化技術開発太陽電池モジュールの分離・マテリアルリサイクル技術開発（結晶シリコン及びＣＩＳ太陽電池モジュールの低環境負荷マテリアルリサイクル技術実証）,159998666,国立研究開発法人新エネルギー・産業技術総合開発機構,,6010401014534
2020-04-01T00:00:00+09:00,起案集計サーバ等一式の更改に係るハードウェア等賃貸借及び保守業務　一式,53124720,特許庁,"富士電機ＩＴソリューション株式会社",6010401015821
2020-04-02T00:00:00+09:00,プリンタ用トナーカートリッジ（経済産業省基盤情報システム用）　６１８本（予定）,17620669,特許庁,,6010601032609
2019-11-14T00:00:00+09:00,エネルギー消費の効率化等に資する我が国技術の国際実証事業実証要件適合性等調査ハイブリッド型再生可能エネルギー発電装置の無電化地域導入を実現するための実証研究（ミャンマー国）,8528300,国立研究開発法人新エネルギー・産業技術総合開発機構,,6011101000700
2020-04-01T00:00:00+09:00,令和２年度タクシー供給に関する請負契約,0,経済産業省,,6011205000092
2020-04-01T00:00:00+09:00,令和２年度原子力の安全性向上に資する技術開発事業（安全性向上に資する新型燃料の既存軽水炉への導入に向けた技術基盤整備）,27854762,資源エネルギー庁,,6050005002007
2020-08-07T00:00:00+09:00,「ゼロカーボン・スチール」の実現に向けた技術開発,23098900,国立研究開発法人新エネルギー・産業技術総合開発機構,,6140001005714
2020-04-10T00:00:00+09:00,特許庁庁舎改修に伴う電算機室内サーバ機器等の移設作業（ＸＭＬ公報サーバ等）　一式,15768585,特許庁,,7010001008844
2018-12-07T00:00:00+09:00,平成３０年度高度な自動走行システムの社会実装に向けた研究開発・実証事業（ＣＡＳＥ時代における次世代技術動向調査）,37746648,経済産業省,,7010001088960
2020-07-30T00:00:00+09:00,ＮＥＤＯ先導研究プログラムエネルギー・環境新技術先導研究プログラム多層プラスチックフィルムの液相ハイブリッドリサイクル技術の開発,13860000,国立研究開発法人新エネルギー・産業技術総合開発機構,,7010005005425
2018-12-27T00:00:00+09:00,平成３０年度石油・ガス供給等に係る保安対策調査等事業（保安力の維持・向上を目的とする基礎調査）,9720000,経済産業省,,7010401001556
2020-04-01T00:00:00+09:00,ＳＰＥＥＤＡの利用,6336000,経済産業省,,7010401075212
2020-07-29T00:00:00+09:00,ＮＥＤＯ先導研究プログラムエネルギー・環境新技術先導研究プログラムＣＯ２利用ＰＣ製造用中間体の新規合成技術開発,2098800,国立研究開発法人新エネルギー・産業技術総合開発機構,,7010701022491
2019-02-22T00:00:00+09:00,経済産業省基盤情報システムのクライアントＰＣに帯するセキュリティ診断業務役務請負,2062800,経済産業省,,7021001009856
2020-08-06T00:00:00+09:00,次世代複合材創製・成形技術開発複合材時代の理想機体構造を実現する機体設計技術の開発,359790800,国立研究開発法人新エネルギー・産業技術総合開発機構,,7370005002147
2020-08-18T00:00:00+09:00,什器類一式の調達,12454464,情報処理推進機構,,8010001036398
2020-04-01T00:00:00+09:00,令和元年度ＧＥＡ国際会議２０２０開催支援業務,89998287,経済産業省／環境省／外務省／文部科学省／農林水産省／国土交通省,,8010001092202
2020-07-31T00:00:00+09:00,カーボンリサイクル実現を加速するバイオ由来製品生産技術の開発カーボンリサイクル実現を加速するバイオ由来製品生産技術の開発データ駆動型統合バイオ生産マネジメントシステム（Ｄａｔａ－ｄｒｉｖｅｎ　ｉＢＭＳ）の研究開発,3000800,国立研究開発法人新エネルギー・産業技術総合開発機構,,8010001132635
2020-07-07T00:00:00+09:00,令和２年度グローバル・スタートアップ・エコシステム強化事業（グローバル・ベンチャー・サミット（仮称））,129991606,経済産業省,,8010401024011
2020-07-30T00:00:00+09:00,ＮＥＤＯ先導研究プログラムエネルギー・環境新技術先導研究プログラム多層プラスチックフィルムの液相ハイブリッドリサイクル技術の開発,14895100,国立研究開発法人新エネルギー・産業技術総合開発機構,,8010401085474
2018-12-13T00:00:00+09:00,平成３０年度地球温暖化対策における国際機関等連携事業（我が国のＣＣＳ技術を用いた国際貢献に向けた連携事業）,15930000,経済産業省,,8011101057185
2020-07-31T00:00:00+09:00,カーボンリサイクル実現を加速するバイオ由来製品生産技術の開発カーボンリサイクル実現を加速するバイオ由来製品生産技術の開発データベース空間からの新規酵素リソースの創出,1498200,国立研究開発法人新エネルギー・産業技術総合開発機構,,8120001088461
2020-08-11T00:00:00+09:00,カーボンリサイクル実現を加速するバイオ由来製品生産技術の開発カーボンリサイクル実現を加速するバイオ由来製品生産技術の開発データベース空間からの新規酵素リソースの創出,4799300,国立研究開発法人新エネルギー・産業技術総合開発機構,,9010001011318
2020-06-30T00:00:00+09:00,令和２年度産業標準化推進事業委託費（戦略的国際標準化加速事業：ルール形成戦略に係る調査研究（ＥＰＣＩＳ普及促進事業））,12653256,経済産業省,,9010001027685
2020-06-30T00:00:00+09:00,令和２年度産業経済研究委託事業（「賃上げ・生産性向上のための税制」・「オープンイノベーション促進税制」利用状況に関する調査）,21450000,経済産業省,,9010001027685
2020-08-17T00:00:00+09:00,太陽光発電主力電源化推進技術開発動向調査等移動体用太陽電池の動向調査,74325900,国立研究開発法人新エネルギー・産業技術総合開発機構,,9010001027685
2019-11-22T00:00:00+09:00,水素社会構築技術開発事業総合調査研究燃料電池自動車等の環境性能評価に関する調査,29827600,国立研究開発法人新エネルギー・産業技術総合開発機構,,9010001027685
2020-04-01T00:00:00+09:00,令和２年度ベンチャー特化型知財ネットワーク構築事業　一式,49925998,特許庁,,9010001067748
2020-04-01T00:00:00+09:00,起案集計サーバ等一式の更改に係るハードウェア等賃貸借及び保守業務　一式,53124720,特許庁,"東京センチュリー株式会社",9010001087242
2020-04-01T00:00:00+09:00,機械学習プログラム作成に係る労働者派遣　２名,22787325,特許庁,,9010401052894
2020-04-01T00:00:00+09:00,画像処理プログラム作成に係る労働者派遣　２名,21647958,特許庁,,9010401052894
2020-06-29T00:00:00+09:00,令和２年度高圧ガス保安対策事業（高圧ガス保安技術基準作成・運用検討）,18988538,経済産業省,,9010405002433
2020-04-01T00:00:00+09:00,審査関係書類等の運搬に係る作業　一式,873356,特許庁,,9010601013820
2020-07-29T00:00:00+09:00,ＮＥＤＯ先導研究プログラムエネルギー・環境新技術先導研究プログラム合金系潜熱蓄熱マイクロカプセルを基盤とした高速かつ高密度な蓄熱技術の研究開発,14641000,国立研究開発法人新エネルギー・産業技術総合開発機構,,9120001077620
2019-04-01T00:00:00+09:00,平成３１年度商工業統計調査事務地方公共団体委託費,87320000,経済産業省,"岩手県,群馬県,千葉県,静岡県,宮城県,山形県,鳥取県,愛媛県,青森県,福島県,福井県,三重県,滋賀県,島根県,岡山県,徳島県,長崎県,宮崎県,鹿児島県,山梨県,愛知県,京都府,奈良県,熊本県,大分県,香川県,広島県,福岡県,秋田県,栃木県,神奈川県,長野県,大阪府,兵庫県,山口県,高知県,沖縄県,北海道,茨城県,東京都,岐阜県,新潟県,富山県,石川県,和歌山県,佐賀県",1000020110001
2019-12-25T00:00:00+09:00,情報処理安全確保支援士講習運営業務（２０２０年度講習運営）,690257920,情報処理推進機構,,1010001034730
2019-04-01T00:00:00+09:00,平成３１年度弁理士試験及び特定侵害訴訟代理業務試験運営等補助業務　一式,41671215,特許庁,,1010001084148
2019-04-01T00:00:00+09:00,経済産業研修所の管理・運営業務,5400000,経済産業省,,1010001139967
2019-09-12T00:00:00+09:00,令和元年度サイバー・フィジカル・セキュリティ対策促進事業（ソフトウェアを安全に利活用するための基盤構築に向けた調査）,12650000,経済産業省,,1010001143390
2019-09-27T00:00:00+09:00,令和元年度産業経済研究委託事業（我が国におけるＦｉｎＴｅｃｈ普及に向けた基盤整備に関する調査検討）,17406092,経済産業省,,1010001143390
2019-07-22T00:00:00+09:00,令和元年度産業保安等技術基準策定研究開発等事業（電気用品等製品のＩｏＴ化等による安全確保の在り方に関する動向調査）,19140000,経済産業省,,1010001143390
2019-06-17T00:00:00+09:00,令和元年度安全保障貿易管理対策事業（貿易救済措置効率的活用手法等調査）,39142084,経済産業省,,1010001143390
2019-04-01T00:00:00+09:00,平成３１年度定期購読新聞（朝日新聞　外１９件）の売買,29040804,経済産業省,,1010005001594
2019-08-14T00:00:00+09:00,令和元年度産業財産権制度問題調査研究「実効的な権利保護に向けた知財紛争処理システムの在り方に関する調査研究」　一式,15510000,特許庁,,1010005016691
2019-11-01T00:00:00+09:00,経済産業省の危機管理広報に係る役務請負,1045000,経済産業省,,1010401085687
2019-11-14T00:00:00+09:00,労働者派遣業務（２０１９年１２月契約開始分【高度事務派遣】）,11380875,情報処理推進機構,,1010401090191
2019-04-01T00:00:00+09:00,平成３１年度安全保障貿易管理情報ＤＢの運用保守業務,9571944,経済産業省,,1010401092989
2019-07-08T00:00:00+09:00,令和元年度産業技術調査事業（海外主要国における研究開発税制等に関する実態調査）,10946100,経済産業省,,1010405003760
2020-01-27T00:00:00+09:00,経済産業省地域別鉱工業生産指数作成システムの改修等業務役務請負,11880000,経済産業省,,1010901026918
2019-10-31T00:00:00+09:00,令和元年度化学物質安全対策（化審法低生産量・少量新規化学物質システム改修事業）,6830604,経済産業省,,1010901026918
2019-08-20T00:00:00+09:00,令和元年度特許出願技術動向調査－レンズ系技術－　　一式,49500000,特許庁,,1011101055823
2019-10-31T00:00:00+09:00,令和元年度地球温暖化問題等対策調査（途上国における適応分野の我が国企業の貢献可視化事業）,17006369,経済産業省,,2010001016851
2019-11-26T00:00:00+09:00,令和元年度小規模事業者支援データ活用研修の開催業務,45099110,中小企業庁,,2010001093321
2019-12-12T00:00:00+09:00,令和元年度ＩＴ活用向上に向けたＩＴ普及実証調査事業,36630000,中小企業庁,,2010001093321
2019-04-01T00:00:00+09:00,期間管理を要する審理案件の管理業務に係る労働者派遣　１名,3831304,特許庁,,2010001098502
2019-07-09T00:00:00+09:00,令和元年度火薬類爆発影響低減化技術基準検討事業,49995217,経済産業省,,2010005003111
2019-07-02T00:00:00+09:00,令和元年度技術協力活用型・新興国市場開拓事業（制度・事業環境整備（産業人材教育機関強化事業））,11999824,経済産業省,,2010005003235
2019-04-01T00:00:00+09:00,リンクリゾルバの利用　一式,1263637,特許庁,,2010401030329
2019-04-01T00:00:00+09:00,リフィニティブ社情報提供サービス,14344325,経済産業省,,2010401031962
2019-08-13T00:00:00+09:00,令和元年度石油・ガス供給等に係る保安対策調査等委託費（小規模鉱山における自主保安の推進のためのマネジメントシステム等に関する調査）,14190000,経済産業省,,2011101025379
2019-04-01T00:00:00+09:00,審判請求事務に係る労働者派遣　４名,10054385,特許庁,,2011101052670
2019-04-01T00:00:00+09:00,平成３１年度地球温暖化問題等対策調査（技術メカニズムに関する調査事業）,11737075,経済産業省,,2130005012678
2019-06-13T00:00:00+09:00,令和元年度商標出願動向調査－マクロ調査－　一式,21450000,特許庁,,3010001024705
2019-04-08T00:00:00+09:00,一般定期健康診断、二次検査及び特別健康診断並びにＶＤＴ作業従事者健康診断の実施　一式,35027982,特許庁,,3010005000875
2019-07-08T00:00:00+09:00,令和元年度サイバー・フィジカル・セキュリティ対策促進事業（スマートホームのサイバーセキュリティ確保に向けた調査）,9185550,経済産業省,,3010005016582
2019-04-01T00:00:00+09:00,平成３１年度燃料安定供給対策に関する調査事業（国際原油市場等を取り巻く環境や市場動向と価格形成に影響を与える諸要因に関する調査）,19800000,資源エネルギー庁,,3010005018926
2019-07-31T00:00:00+09:00,令和元年度産業技術調査事業（研究開発税制等の今後の在り方に関する調査）,13618000,経済産業省,,3010401011971
2019-07-02T00:00:00+09:00,令和元年度産業財産権制度問題調査研究「児童、生徒及び学生のアイデアの活用に関する調査研究」　　一式,13936505,特許庁,,3010401011971
2019-06-28T00:00:00+09:00,令和元年度産業財産権制度各国比較調査研究等事業「各国における権利回復等の救済措置の基準及び運用実態に関する調査研究」　　一式,21679400,特許庁,,3010405010615
2019-08-29T00:00:00+09:00,令和元年度経済産業省デジタルプラットフォーム構築事業（法人データ交換基盤の構築・運用に関する実証・調査事業）,104474026,経済産業省,,3010601021713
2019-10-29T00:00:00+09:00,国立研究開発法人新エネルギー・産業技術総合開発機構平成３０事業年度財務諸表に関する官報公告,1766412,国立研究開発法人新エネルギー・産業技術総合開発機構,,3020001029587
2019-04-01T00:00:00+09:00,平成３１年度貿易保険情報システムの利用及び保守運用支援,407536499,経済産業省,,3020001081423
2019-04-01T00:00:00+09:00,コンピュータソフトウェア関連文献の保管及び搬出・搬入　一式,2373142,特許庁,,3370801000134
2019-06-26T00:00:00+09:00,令和元年度化学物質安全対策（途上国におけるオゾン層破壊物質等の転換プロジェクト推進及び特定物質等の破壊についての状況調査等事業）,26400000,経済産業省,,4010001054032
2019-12-13T00:00:00+09:00,令和元年度アウトリサーチ強化による中小企業海外展開の裾野拡大事業,51700000,中小企業庁,,4010001054032
2019-04-01T00:00:00+09:00,「レコフＭ＆Ａデータベース」の利用,1090000,経済産業省,,4010001116550
2019-09-11T00:00:00+09:00,組織内における「人脈の共有・見える化」に係る実証事業,8679000,経済産業省,,4010001120965
2019-04-01T00:00:00+09:00,平成３１年度国内における温室効果ガス排出削減・吸収量認証制度の実施委託費（個人向け補助事業に係るプログラム型プロジェクトの運営・管理）,14619220,経済産業省,,4010001129148
2019-11-14T00:00:00+09:00,情報処理技術者試験等事業（大阪試験地、滋賀試験地、和歌山試験地及び姫路試験地）,396396000,情報処理推進機構,,4010401022860
2019-04-01T00:00:00+09:00,事業用電気工作物管理システム等運用支援業務,14606000,経済産業省,,4010401058525
2020-01-22T00:00:00+09:00,アジア共通統一試験推進コア人材育成事業の実施に係わる航空券手配等業務,1838800,情報処理推進機構,,4010601042469
2019-04-01T00:00:00+09:00,医療保険事務に係る労働者派遣　１名,3223973,特許庁,,4010701023352
2019-11-25T00:00:00+09:00,自然科学関係データベースを有するインターネットサイトの利用　一式,11970000,特許庁,,4011101005131
2020-01-31T00:00:00+09:00,ｉＰａｄ外２件の購入,8250000,経済産業省,,4040001006757
2019-08-29T00:00:00+09:00,令和元年度　大学の技術動向調査　　一式,15400000,特許庁,,5010001022137
2019-05-28T00:00:00+09:00,ＲＦＩＤタグラベルの購入　１３２，０００枚,5274720,特許庁,,5010401008297
2020-01-23T00:00:00+09:00,ＩＴシステム・サービスの業務委託契約書見直しに関する調査支援業務,3245000,情報処理推進機構,,5010401023057
2019-04-01T00:00:00+09:00,平成３１年度宇宙産業技術情報基盤整備研究開発事業（民生部品等を活用した宇宙機器の軌道上等実証）,52476000,経済産業省,,5010401080445
2019-04-17T00:00:00+09:00,平成３１年度エネルギー需給構造高度化対策に関する調査（今後の電力系統と送配電事業の在り方に関する調査）,30294000,資源エネルギー庁,,5010405001703
2019-04-17T00:00:00+09:00,平成３１年度エネルギー需給構造高度化対策に関する調査（託送料金制度の在り方等に関する詳細調査分析）,26048000,資源エネルギー庁,,5010405001703
2019-07-10T00:00:00+09:00,令和元年度石油・ガス供給等に係る保安対策調査等事業（経年埋設ガス管のリスク評価手法・基準開発事業）,29942695,経済産業省,,5010405009408
2019-04-01T00:00:00+09:00,平成３１年度インターネットライブ中継業務,4533300,経済産業省,,5011101043477
2019-05-13T00:00:00+09:00,日インドネシアＥＰＡ第１２回合同委員会,4486969,経済産業省／外務省／財務省／農林水産省,,5013301022046
2019-05-09T00:00:00+09:00,令和元年度大分野別出願動向調査－一般分野－　一式,41250000,特許庁,,5020001065234
2019-08-08T00:00:00+09:00,令和元年度内外一体の経済成長戦略構築にかかる国際経済調査事業（諸外国における需給調整市場関連制度及び託送料金負担に関する制度の検討状況等に係る調査事業）,29040000,経済産業省,,6010001030403
2019-07-12T00:00:00+09:00,令和元年度新エネルギー等の保安規制高度化事業委託調査（遠隔監視制御活用拡大のための要件等検討事業）,49500000,経済産業省,,6010001030403
